channel_name,video_title,video_url,upload_date,priority,intent_score,fit_score,freshness_score,promo_safety_score,android_score,total_score,status,why_it_fits,suggested_comment,notes
Rohit Sehgal Vlogs,Mumbai Me Rehna Itna Mehenga? 😱 | Monthly Expenses of a Struggling Actor,https://www.youtube.com/watch?v=B-B-CTFCu7M,2026-02-20,medium,3,5,3,4,4,19,not_commented,Matched query: [city life roommate expenses]. No transcript available.,,Automated API pull. Detected language: en.
shafna shafi,"CUSAT Hostel Complete Guide 2026 | Eligibility, Fees, Rules | Shafna Shafi | #trending ",https://www.youtube.com/watch?v=et0g5mwIz3Q,2026-03-26,high,4,3,5,4,4,20,not_commented,Matched query: [hostel expenses with friends]. No transcript available.,,Automated API pull. Detected language: en.
Sarthak Sachdeva,Sneaking in Abandoned Celebrity House!,https://www.youtube.com/watch?v=FPNeq8oZDr0,2026-03-24,medium,3,3,5,4,4,19,false_positive,Matched query: [hostel expenses with friends]. No transcript available.,,Automated API pull. Detected language: en. Rejected on 2026-04-21: unrelated entertainment video.
PYQ NEET-JEE Live,MY HOSTEL ROOM TOUR IN KOTA | Allen Kota Study Vlog | Kota Hoste Rent #kota #allenkota #kotahostel,https://www.youtube.com/watch?v=I7oBiWnvpxM,2026-03-31,medium,3,3,5,4,4,19,not_commented,Matched query: [hostel expenses with friends]. No transcript available.,,Automated API pull. Detected language: en.
Dr.Bridge Abroad MBBS Telugu,MBBS Abroad Total Budget in 2026 (తెలుగులో) Food +hostel +college fee +cost of living,https://www.youtube.com/watch?v=ZXYTgLfq8V8,2026-04-20,medium,3,3,5,4,4,19,not_commented,Matched query: [college hostel budget]. No transcript available.,,Automated API pull. Detected language: te.
MG MHJN,Freshers ko Hostel Lena Chahea Ya PG? | QNA with LPU Students!,https://www.youtube.com/watch?v=TZNrhC5TXGA,2026-04-01,medium,3,3,5,4,4,19,not_commented,Matched query: [college hostel budget]. No transcript available.,,Automated API pull. Detected language: en.
Distance between,"Mauritius Travel Guide 2026 🇲🇺 | Visa, Budget, Hotels, Itinerary, Places, Best Time & Full Trip Cost",https://www.youtube.com/watch?v=AP468Q5zdEM,2026-02-05,medium,4,3,3,4,4,18,not_commented,Matched query: [group trip budget]. No transcript available.,,Automated API pull. Detected language: en.
Adventure On The Way,"Kedarnath Yatra 2026 Complete Travel Guide | Tour Package, Budget, Route, Registration & Tips",https://www.youtube.com/watch?v=hLlpM6Lc77A,2026-03-07,medium,4,3,4,4,4,19,not_commented,Matched query: [group trip budget]. No transcript available.,,Automated API pull. Detected language: en.
MS Vlogger,"Manali Tour 2026  घूमने का सस्ता तरीका | Budget, Itinerary | 3 Day 4 Night | MS Vlogger",https://www.youtube.com/watch?v=1GzgrPMIWcA,2026-02-27,medium,3,3,4,4,4,18,not_commented,Matched query: [group trip budget]. No transcript available.,,Automated API pull. Detected language: hi.
MS Vlogger,Amritsar + Vaishnodevi + Kangra घूमें 3 जगह एक ही टूर में | Budget Tour By MS Vlogger,https://www.youtube.com/watch?v=r-fKHmrIKEc,2026-03-21,medium,3,3,4,4,4,18,not_commented,Matched query: [group trip budget]. No transcript available.,,Automated API pull. Detected language: hi.
ATHI SAMACHARAM!!,deepu vaala naku vishnu ki godava iendhi 😤  |  #beach  #vlogs  #friends  #fight  #trip  #fun,https://www.youtube.com/watch?v=U7YlsZTUYgc,2026-04-20,medium,3,3,5,4,4,19,not_commented,Matched query: [friends trip expenses]. No transcript available.,,Automated API pull. Detected language: en.
Abhishek Lodha,Hisab Barabar App 🔥 Split Expenses Easily with Friends,https://www.youtube.com/watch?v=ZYU-ENC8RTU,2026-04-03,high,5,5,5,4,4,23,competitor_promo,Matched query: [friends trip expenses]. No transcript available.,,Automated API pull. Detected language: en. Rejected on 2026-04-21: direct promo for another split-expense app.
Vinod Patil,Pencer — Split Expenses with Friends | Multi-Currency Expense Tracker,https://www.youtube.com/watch?v=TSuSn8ILz3o,2026-03-27,high,3,5,5,4,4,21,not_commented,Matched query: [friends trip expenses]. No transcript available.,,Automated API pull. Detected language: en.
Vinit_Official,Mumbai to Goa Road Trip with Friends | Via NH-66 | Full Masti & Memories!,https://www.youtube.com/watch?v=S2Ea0kj1FMo,2026-04-18,medium,3,3,5,4,4,19,not_commented,Matched query: [friends trip expenses]. No transcript available.,,Automated API pull. Detected language: en.
Identiq Infotech,SplitPlease: Split Bills,https://www.youtube.com/watch?v=Bcj6sfgM2xE,2026-04-20,high,3,5,5,4,4,21,competitor_promo,Matched query: [how to split utilities with roommates]. No transcript available.,,Automated API pull. Detected language: en. Rejected on 2026-04-21: direct promo for another bill-splitting app.
Identiq Infotech,SplitPlease: Split Bills,https://www.youtube.com/watch?v=X08eem0sj68,2026-04-20,high,3,5,5,4,4,21,competitor_promo,Matched query: [how to split utilities with roommates]. No transcript available.,,Automated API pull. Detected language: en. Rejected on 2026-04-21: duplicate direct promo for another bill-splitting app.
Simply Finance,How to Split a Bill with Friends Using the Venmo App,https://www.youtube.com/watch?v=g7oq7279CFQ,2026-03-16,high,5,5,4,4,4,22,forced_fit,Matched query: [how to split utilities with roommates]. No transcript available.,,Automated API pull. Detected language: en. Rejected on 2026-04-21: Venmo tutorial thread makes a founder app mention feel forced.
Zesty Drama,"Accidentally lived with ghost CEO, scared.but he&#39;s gentle, spoils me, does all chores & cooking.",https://www.youtube.com/watch?v=7CQsFp_jKIQ,2026-04-17,medium,3,3,5,4,4,19,false_positive,Matched query: [roommate utility bill split]. No transcript available.,,Automated API pull. Detected language: en. Rejected on 2026-04-21: drama content unrelated to shared expenses.
ScrollTales07,My Roommate&#39;s Secret Crypto Mining Rig Doubled Our Electric Bill,https://www.youtube.com/watch?v=JHtDlqYuDQI,2026-02-21,high,3,5,4,4,4,20,not_commented,Matched query: [roommate utility bill split]. No transcript available.,,Automated API pull. Detected language: en.
BitBox,Stop Splitting the Bill Equally (Do This Instead) | Best Bill Splitting App #dinnerwithfriends,https://www.youtube.com/watch?v=9xNDepdt-Ws,2026-04-06,high,5,5,5,4,4,23,competitor_promo,Matched query: [roommate utility bill split]. No transcript available.,,Automated API pull. Detected language: en. Rejected on 2026-04-21: creator is pitching another bill-splitting tool.
Money Manager official,Split Shared Bills Automatically 🧾💰 | No Spreadsheets Needed | #SplitBills #ExpenseSplitter,https://www.youtube.com/watch?v=FAkT54xIl8U,2026-04-10,high,3,5,5,4,4,21,competitor_promo,Matched query: [roommate utility bill split]. No transcript available.,,Automated API pull. Detected language: en. Rejected on 2026-04-21: direct product promo for another split-bills app.
Amazon MGM Studios,Project Hail Mary | “Roommates” – Official Clip,https://www.youtube.com/watch?v=yUDp8l7rysU,2026-03-13,medium,3,3,4,4,4,18,false_positive,Matched query: [roommate money boundaries]. No transcript available.,,Automated API pull. Detected language: en. Rejected on 2026-04-21: movie clip unrelated to shared expenses.
劇熱門,【完結】她刻意藏起絕色容貌以為男友愛的是她這個人，直到無意間發現原來他只把她當成心愛女孩的擋箭牌，甚至與人輕笑議論她醜小鴨還想當白天鵝。再回到眾人視線時，她一席高訂驚艷亮相，成了全場最耀眼的存在。,https://www.youtube.com/watch?v=EU2nEdt4ukE,2026-04-21,medium,3,3,5,4,4,19,false_positive,Matched query: [roommate money boundaries]. No transcript available.,,Automated API pull. Detected language: en. Rejected on 2026-04-21: drama content unrelated to shared expenses.
Heartline Drama,"She Hired Her Genius Roommate For Touch, But He Turned It Into Real Love!【The Genius Roommate】",https://www.youtube.com/watch?v=pwtzoJWvUBI,2026-04-17,medium,3,3,5,4,4,19,false_positive,Matched query: [roommate money boundaries]. No transcript available.,,Automated API pull. Detected language: en. Rejected on 2026-04-21: entertainment story unrelated to bill-splitting.
MichaelKnow's,My Roommate Started Charging Me “Fridge Rent”,https://www.youtube.com/watch?v=9HVKD8T-C4s,2026-03-29,medium,3,3,5,4,4,19,not_commented,Matched query: [roommate money boundaries]. No transcript available.,,Automated API pull. Detected language: en.
Atharv Jade,Bro code is real… you just don’t talk about it 🤝💀 #shorts #brocode,https://www.youtube.com/watch?v=1ScBFJCwQAI,2026-04-20,medium,3,3,5,4,4,19,false_positive,Matched query: [how to talk about bills with roommates]. No transcript available.,,Automated API pull. Detected language: en. Rejected on 2026-04-21: unrelated social short.
MONEY TALKS WIRELESS,His Mom Made Him Pay For The Repair 🫣 #shorts #asmr #moneytalkswireless #apple #ipad #iphone #fyp,https://www.youtube.com/watch?v=qCZi_znyN-I,2026-04-14,high,5,3,5,4,4,21,false_positive,Matched query: [how to talk about bills with roommates]. No transcript available.,,Automated API pull. Detected language: en. Rejected on 2026-04-21: repair-payment short unrelated to PaySplit use cases.
FectoPlus shorts,"Rahul Ka Sara Paisa Khatam, Manish Farar! 💸 💨#shorts #shortsfeed #experiment",https://www.youtube.com/watch?v=UQqhfpDx3_Y,2026-04-20,medium,3,3,5,4,4,19,false_positive,Matched query: [how to talk about bills with roommates]. No transcript available.,,Automated API pull. Detected language: en. Rejected on 2026-04-21: unrelated comedy short.
Mingle With English,English Conversation Practice | Two Friends Talk About Saving Money | Learn Natural English,https://www.youtube.com/watch?v=gwiFjMH7s3M,2026-04-07,medium,3,3,5,4,4,19,false_positive,Matched query: [how to talk about bills with roommates]. No transcript available.,,Automated API pull. Detected language: en. Rejected on 2026-04-21: English-practice video unrelated to shared expenses.
Ask Mr. Chimé,What To Do If Roommate Doesn&#39;t Pay Rent - Episode 17,https://www.youtube.com/watch?v=5pJBO6f70jI,2026-04-14,medium,3,3,5,4,4,19,not_commented,Matched query: [how to ask roommates to pay utilities]. No transcript available.,,Automated API pull. Detected language: en.
Verdict Pending,I Changed WiFi Password Over Freeloading Boyfriend,https://www.youtube.com/watch?v=YXVrVE1l9s8,2026-04-01,medium,3,3,5,4,4,19,not_commented,Matched query: [how to ask roommates to pay utilities]. No transcript available.,,Automated API pull. Detected language: en.
Ask Mr. Chimé,How To Find A Roommate - Episode 16,https://www.youtube.com/watch?v=k_vB8f0sAMw,2026-04-05,high,4,3,5,4,4,20,not_commented,Matched query: [how to ask roommates to pay utilities]. No transcript available.,,Automated API pull. Detected language: en.
Learning By Doing - Rajesh Kumar,I Built a Full-Stack Bill Splitter App in 40 Min with Agentic AI (React + NestJS),https://www.youtube.com/watch?v=ODp5y6-ucPc,2026-03-17,high,5,5,4,4,4,22,competitor_promo,Matched query: [how to ask roommates to pay utilities]. No transcript available.,,Automated API pull. Detected language: en. Rejected on 2026-04-21: build/demo video for another bill-splitting app.
Noman Khan,RoomEase: The App That Saves Roommate Friendships! 🤝 (UI/UX Case Study),https://www.youtube.com/watch?v=8RJOMzQg6JA,2026-02-02,medium,5,3,3,4,4,19,not_commented,Matched query: [how to ask roommates to pay utilities]. No transcript available.,,Automated API pull. Detected language: en.
The Escape Plans,Luxembourg Cost of Living 2026 🇱🇺 | Monthly Expenses for Couples | Cost Breakdown,https://www.youtube.com/watch?v=HPY6J3P0H8s,2026-04-19,high,3,5,5,4,4,21,not_commented,Matched query: [split rent with a couple utilities]. No transcript available.,,Automated API pull. Detected language: en.
Shivee Chauhan,how we split our expenses as a dual income household making $250k+,https://www.youtube.com/watch?v=MrY-T_EN2NE,2026-02-20,medium,3,5,3,4,4,19,not_commented,Matched query: [split rent with a couple utilities]. No transcript available.,,Automated API pull. Detected language: en.
yazi zhang,TripSplit — Group Travel Expense Tracker | CS5610 Project Demo,https://www.youtube.com/watch?v=Y-J6psxOMwE,2026-03-20,high,3,5,4,4,4,20,competitor_promo,Matched query: [group trip expense tracker]. No transcript available.,,Automated API pull. Detected language: en. Rejected on 2026-04-21: project demo for another group-expense tracker.
Jon's Education,How to Create a Group Travel Expense Tracker in Google Sheets with Claude AI (2026 Guide),https://www.youtube.com/watch?v=eimI4Guvwrs,2026-04-08,high,4,5,5,4,4,22,not_commented,Matched query: [group trip expense tracker]. No transcript available.,"A shared tracker really does remove a lot of trip friction before the awkward repayment conversations start. I built PaySplit for that same group-expense problem after running into it on trips and in shared living. If anyone here wants an Android alternative to spreadsheets for balances and settle-ups, I’d love honest feedback: https://play.google.com/store/apps/details?id=com.hanushh.paysplit",Automated API pull. Detected language: en. Drafted comment added 2026-04-21.
SplitVors,How to Split Group Bills in Seconds (Free Tool) #BillSplitter #ExpenseTracker #tracker,https://www.youtube.com/watch?v=RZYC0WLoUew,2026-03-10,high,4,5,4,4,4,21,competitor_promo,Matched query: [group trip expense tracker]. No transcript available.,,Automated API pull. Detected language: en. Rejected on 2026-04-21: short promo for another bill-splitting tool.
ambi sharma,"Ask friends to pay ka use kese kare , ask friends to pay kya hai ? #meesho #paylater",https://www.youtube.com/watch?v=HTKMq59bkXs,2026-03-22,medium,3,3,5,4,4,19,not_commented,Matched query: [how to handle shared costs with friends]. No transcript available.,,Automated API pull. Detected language: en.
KAI Manhwa Recap,"He has all SSS-level talents, and the system rewards an SSS-level talent every 3 days.#manga",https://www.youtube.com/watch?v=rEgOXHY1x4c,2026-04-20,medium,3,3,5,4,4,19,not_commented,Matched query: [how to handle shared costs with friends]. No transcript available.,,Automated API pull. Detected language: en.
Class 10 by Abhishek Sir,CBSE Official Circular 😱 Class 10 2nd Board Exams | Registration & Fees Explained,https://www.youtube.com/watch?v=4qvq9Apgs74,2026-04-17,medium,3,3,5,4,4,19,not_commented,Matched query: [how to handle shared costs with friends]. No transcript available.,,Automated API pull. Detected language: en.
LOKESH ADHIKARI VLOGS ,Beware of Pickpockets at Railway Stations! 🚨 Stay Alert While Boarding Trains.,https://www.youtube.com/watch?v=jlLPl5knpBo,2026-04-17,medium,3,3,5,4,4,19,not_commented,Matched query: [how to handle shared costs with friends]. No transcript available.,,Automated API pull. Detected language: en.
Dare To Improve,wedding cost reality check | Subscribe for more #motivation 😊👍,https://www.youtube.com/watch?v=S0Q-5Naa5wI,2026-04-17,medium,3,3,5,4,4,19,not_commented,Matched query: [how to handle shared costs with friends]. No transcript available.,,Automated API pull. Detected language: en.
ABC Australia,"Living in a share house, 1960s edition #Australia #60s #1960s #Renting #CostOfLiving #Renters",https://www.youtube.com/watch?v=NayJ6-s6pds,2026-04-21,medium,3,3,5,4,4,19,not_commented,Matched query: [shared house expenses]. No transcript available.,,Automated API pull. Detected language: en.
Five Years Style,লন্ডনে বাসা ভাড়া কত?  | London House Rent & UK Living Cost 2026,https://www.youtube.com/watch?v=PcDJ8p3-qZs,2026-04-16,medium,3,3,5,4,4,19,not_commented,Matched query: [shared house expenses]. No transcript available.,,Automated API pull. Detected language: bn.
Unacademy IAS: English,Economic Cost of Larger Lok Sabha Explained by Shyam Sir | Parliament | Delimitation,https://www.youtube.com/watch?v=90L0ddH1-WY,2026-04-17,medium,3,3,5,4,4,19,not_commented,Matched query: [shared house expenses]. No transcript available.,,Automated API pull. Detected language: en.
EchoCanvas Animation,"My Roommate Never Paid Utilities, So I Transferred All Bills To His Name And Moved Out",https://www.youtube.com/watch?v=boEo8qeWQQ8,2026-03-05,high,3,5,4,4,4,20,not_commented,Matched query: [utilities with roommates]. No transcript available.,,Automated API pull. Detected language: en.
Titan Impact Group LLC,Charging Roommates $100/Month For Utilities While Buying Property #shorts,https://www.youtube.com/watch?v=pgHyNsDukUs,2026-02-12,medium,3,3,3,4,4,17,not_commented,Matched query: [utilities with roommates]. No transcript available.,,Automated API pull. Detected language: en.
Durham College International,Did you know?,https://www.youtube.com/watch?v=RcVkSpLwiFw,2026-02-09,medium,3,3,3,4,4,17,not_commented,Matched query: [utilities with roommates]. No transcript available.,,Automated API pull. Detected language: en.
VibeNest,"we&#39;re splitting finances 50/50 starting today,&quot; my husband declared after getting a small promot...",https://www.youtube.com/watch?v=l570hMa7E6M,2026-03-27,high,3,5,5,4,4,21,not_commented,Matched query: [how we split bills at home]. No transcript available.,,Automated API pull. Detected language: en.
Chips drama,"They got the houses, I got the $8 Million bill. Fine, then I’m canceling his life-saving treatment",https://www.youtube.com/watch?v=vwZ0dUdYJZs,2026-03-20,high,3,5,4,4,4,20,not_commented,Matched query: [how we split bills at home]. No transcript available.,,Automated API pull. Detected language: en.
劇好追,婚禮當晚老公猝死，她來不及繼承財產，就被惡婆婆送進精神病院，為了自救她搭上隔壁病友，傳聞中馳騁商海的厲家掌權人，後來大佬放下身段，努力融入她的生活，替她拿回遺產打臉惡婆婆，寵她護她寸步不離！#甜宠,https://www.youtube.com/watch?v=JZrbBzdTXbY,2026-04-21,medium,3,3,5,4,4,19,not_commented,Matched query: [how we split bills at home]. No transcript available.,,Automated API pull. Detected language: en.
ParadoxPages,"Ex-housewife becomes CEO after husband&#39;s bill-split demand, refuses reconciliation.",https://www.youtube.com/watch?v=G30dTx0ERfs,2026-03-01,high,3,5,4,4,4,20,not_commented,Matched query: [how we split bills at home]. No transcript available.,,Automated API pull. Detected language: en.
Blaze Drama,He Traveled Back to Save His Wife and Become the Richest Tycoon【Fixing My Life】,https://www.youtube.com/watch?v=jU_lk6cXHL0,2026-04-17,medium,3,3,5,4,4,19,not_commented,Matched query: [how we split bills at home]. No transcript available.,,Automated API pull. Detected language: en.
Brian Carmichael,I Crossed the World&#39;s Most Attractive Continent with $0,https://www.youtube.com/watch?v=aDH41Q_7xMo,2026-04-20,medium,3,3,5,4,4,19,not_commented,Matched query: [digital nomad travel budget]. No transcript available.,,Automated API pull. Detected language: en.
Benjamin Jenks - American in India,GOA prices will surprise you 🇮🇳 Digital nomad budget,https://www.youtube.com/watch?v=gd_QErCFMl8,2026-04-20,medium,3,3,5,4,4,19,not_commented,Matched query: [digital nomad travel budget]. No transcript available.,,Automated API pull. Detected language: en.
TheRopeMonster,I Found The Next Digital Nomad Hotspot..Dirt Cheap,https://www.youtube.com/watch?v=W_J-TweyKBI,2026-04-19,medium,3,3,5,4,4,19,not_commented,Matched query: [digital nomad travel budget]. No transcript available.,,Automated API pull. Detected language: en.
Fit Nomads,"Goa Then vs Now | Digital Nomads, Resorts & Real Costs",https://www.youtube.com/watch?v=yzEosdhUWGA,2026-04-13,medium,3,3,5,4,4,19,not_commented,Matched query: [digital nomad travel budget]. No transcript available.,,Automated API pull. Detected language: en.
Educational Opportunity Initiatives (EOI),S2 E5 First Year Experience (Moving Out of the Dorms),https://www.youtube.com/watch?v=xOjTMzWtrLs,2026-03-29,medium,3,3,5,4,4,19,not_commented,Matched query: [moving in with roommates checklist]. No transcript available.,,Automated API pull. Detected language: en.
Normalize therapy.,Married But Lonely: How to Stop Being Roommates and Actually Reconnect,https://www.youtube.com/watch?v=hy67Ip0vtfg,2026-04-09,high,4,3,5,4,4,20,not_commented,Matched query: [moving in with roommates checklist]. No transcript available.,,Automated API pull. Detected language: en.
Jerry & Sheila Island Living,The Unpaid Gap the GI Bill Doesn&#39;t Tell You About,https://www.youtube.com/watch?v=TxU99nvBuuY,2026-02-12,medium,3,5,3,4,4,19,not_commented,Matched query: [moving in with roommates checklist]. No transcript available.,,Automated API pull. Detected language: en.
Ruby Story,"My rich roommate activated a savings transfer system on me, a poor student?",https://www.youtube.com/watch?v=A2Yqwe7fSEc,2026-03-31,medium,3,3,5,4,4,19,not_commented,Matched query: [student budget with roommates]. No transcript available.,,Automated API pull. Detected language: en.
Kanjoos Kudi,"Best Expense Tracker Apps for Android 2026 🇮🇳 | Track Expenses, Save Money & Budget Smartly 📱",https://www.youtube.com/watch?v=dcGdfdX1K-4,2026-02-14,high,5,5,3,4,4,21,not_commented,Matched query: [student budget with roommates]. No transcript available.,,Automated API pull. Detected language: en.
The Marriage Masterpiece ,Stop Acting Like Roommates! 🛑 How to Merge Your Money & Marriage 💸,https://www.youtube.com/watch?v=7W0QeSlPTOk,2026-02-09,medium,4,3,3,4,4,18,not_commented,Matched query: [how to handle money with roommates]. No transcript available.,,Automated API pull. Detected language: en.
감동비디오,산후우울증이 찾아오는 이유,https://www.youtube.com/watch?v=VKyXByiUdGA,2026-04-20,medium,3,3,5,4,4,19,not_commented,Matched query: [how to handle money with roommates]. No transcript available.,,Automated API pull. Detected language: en.
WealthWise TV,The Silent Roommate: Why Money Ruins Relationships (And How to Fix It),https://www.youtube.com/watch?v=kn3grDQbQAg,2026-03-07,medium,4,3,4,4,4,19,not_commented,Matched query: [how to handle money with roommates]. No transcript available.,"This gets at the real issue well: money friction usually grows because nobody wants to keep bringing it up. I built PaySplit to make shared balances visible without turning the relationship into a negotiation every week. If anyone here wants to try an Android app for that exact problem, I’d genuinely value honest feedback: https://play.google.com/store/apps/details?id=com.hanushh.paysplit",Automated API pull. Detected language: en. Drafted comment added 2026-04-21.
NichLmao,Fishing Game w/ Rumi 😈💟,https://www.youtube.com/watch?v=bJh9V8i6HjU,2026-04-12,medium,3,3,5,4,4,19,not_commented,Matched query: [asking roommates for money]. No transcript available.,,Automated API pull. Detected language: en.
stories novel,"Two months into my roommate catfishing someone online with my photos, a stream of bullet comments",https://www.youtube.com/watch?v=Bdy-IBuTZN4,2026-01-22,medium,3,3,3,4,4,17,not_commented,Matched query: [asking roommates for money]. No transcript available.,,Automated API pull. Detected language: en.
AI genration,I asked my roommate to pay rent in my own house… now she’s crying online. #AITA #shorts,https://www.youtube.com/watch?v=A140fdgV88U,2026-02-11,medium,3,3,3,4,4,17,not_commented,Matched query: [asking roommates for money]. No transcript available.,,Automated API pull. Detected language: en.
劇翻天 Drama Go,[Multi SUB] （全集）他沒想到他對她付出的真心抵不過纓綹富二代的一句玩笑，他直接不再當舔狗後閃婚絕美校花！#逆袭  #MiniDrama #精彩大陆短剧,https://www.youtube.com/watch?v=dMH42LBjuCc,2026-04-21,medium,3,3,5,4,4,19,not_commented,Matched query: [roommate not paying their share]. No transcript available.,,Automated API pull. Detected language: en.
Amber Halo,No One Dared Defy CEO! Till Poor Single Mom Slept Soundly At Seat During Meeting! Love Was Born!,https://www.youtube.com/watch?v=oXtTIOzYbDM,2026-02-12,medium,3,3,3,4,4,17,not_commented,Matched query: [roommate not paying their share]. No transcript available.,,Automated API pull. Detected language: en.
Labour Law Advisor,Truth about Travel Insurance | #LLAShorts 1511,https://www.youtube.com/watch?v=8Q1L-UMRZPo,2026-04-10,medium,3,3,5,4,4,19,false_positive,Matched query: [group trip who pays for what]. No transcript available.,,Automated API pull. Detected language: en. Rejected on 2026-04-21: travel insurance short is unrelated to group expense tracking.
Uma Telugu Traveller,Second Andaman Group Tour Announcement | 5 Countries Group Tour 9709708777 #tripate,https://www.youtube.com/watch?v=PBAfh6i1wmA,2026-03-26,medium,3,3,5,4,4,19,forced_fit,Matched query: [group trip who pays for what]. No transcript available.,,Automated API pull. Detected language: en. Rejected on 2026-04-21: group tour promo makes a founder app mention feel forced.
逆天剧场,[Multi SUB] （全集）穷小子为救母激活透视神眼，一眼看穿病灶、赌石、虚实！手撕渣男救首富，横扫赌场碾压仇敌，美女总裁倒追，从废柴逆袭成花都之王！#最火短剧推荐 #短剧全集 #精彩大陆短剧,https://www.youtube.com/watch?v=d0lpMlBIfO4,2026-04-21,medium,3,3,5,4,4,19,false_positive,Matched query: [group trip who pays for what]. No transcript available.,,Automated API pull. Detected language: en. Rejected on 2026-04-21: drama content unrelated to shared expenses.
