channel_name,video_title,video_url,upload_date,priority,intent_score,fit_score,freshness_score,promo_safety_score,android_score,total_score,status,why_it_fits,suggested_comment,notes
NDA,How to Financially pay for the Japan 2026 trip #japan #finance #money #trip #friends #shorts,https://www.youtube.com/watch?v=PaZOPoKKc8k,2026-01-28,medium,4,3,4,4,4,19,not_commented,Matched query: [travel etiquette with friends money]. No transcript available.,,Automated API pull. Detected language: en.
Boss Wallah Daily Tamil,Election Cash Rules Explained in Tamil 2026 | Carrying Cash in Election Time?😳Avoid These Mistakes ❌,https://www.youtube.com/watch?v=tHeq6W0pGRU,2026-03-20,medium,3,3,5,4,4,19,false_positive,Matched query: [travel etiquette with friends money]. No transcript available.,,Automated API pull. Detected language: en. Rejected on 2026-04-20: tax/election rules false positive.
Wander Wise,Surprising Etiquette Moments That Save Global Trips,https://www.youtube.com/watch?v=tW_pUT0qibM,2026-03-10,medium,3,3,5,4,4,19,not_commented,Matched query: [travel etiquette with friends money]. No transcript available.,,Automated API pull. Detected language: en.
Boss Wallah (Malayalam)	,New Income Tax Cash Rules From April 1st | Avoid Heavy Tax Penalty | Cash Transaction Limit in 2026,https://www.youtube.com/watch?v=YpmBq_czLzk,2026-03-24,medium,3,3,5,4,4,19,false_positive,Matched query: [shared expenses etiquette]. No transcript available.,,Automated API pull. Detected language: en. Rejected on 2026-04-20: income-tax false positive.
WOW CHANNEL TV,How Couples Split Expenses with Unequal Income | Relationship Money Rules | Smart Finance Strategy,https://www.youtube.com/watch?v=zl9fOX62tzg,2026-03-14,high,3,5,5,4,4,21,not_commented,Matched query: [shared expenses etiquette]. No transcript available.,"This is a solid point that unequal income and equal costs are not the same conversation. I’m building PaySplit for shared-expense setups like this, and exact or percentage splits are the feature people end up needing most. If anyone here is on Android, I’d appreciate honest feedback on whether the current app handles that fairly: https://play.google.com/store/apps/details?id=com.hanushh.paysplit",Automated API pull. Detected language: en. Drafted comment added 2026-04-20.
By Deepak Jangra,Still using cash without knowing these rules?,https://www.youtube.com/watch?v=QsSuBxfYVBk,2026-02-17,medium,3,3,4,4,4,18,not_commented,Matched query: [shared expenses etiquette]. No transcript available.,,Automated API pull. Detected language: en.
Boss Wallah Daily Telugu,New Income Tax Rules Telugu | Saving Account Cash Limit from April 1st 2026 | Abullaise Syed,https://www.youtube.com/watch?v=VEIhud1WeZ4,2026-03-25,medium,3,3,5,4,4,19,false_positive,Matched query: [shared expenses etiquette]. No transcript available.,,Automated API pull. Detected language: en. Rejected on 2026-04-20: income-tax false positive.
Angel One,150% STT hike- How does it Impact you?,https://www.youtube.com/watch?v=nN_jsCcxeow,2026-02-01,medium,3,3,4,4,4,18,not_commented,Matched query: [shared expenses etiquette]. No transcript available.,,Automated API pull. Detected language: en.
Venmai Kitchen,💥உகாண்டாவில் இந்தியாவை விட செலவு அதிகமா?ஆப்பிரிக்காவை இணைக்கும் தமிழர்|Cost ofliving Uganda|Expenses,https://www.youtube.com/watch?v=coxMB8yyE10,2026-03-21,high,3,5,5,4,4,21,not_commented,Matched query: [how to handle shared costs with friends]. No transcript available.,,Automated API pull. Detected language: ta.
Shashi Dhiman,Asking for a friend | Episode 6 | Standup Comedy show ft @ComicKaustubhAgarwal & @ShashiDhiman,https://www.youtube.com/watch?v=v9jacgf75Pk,2026-01-24,medium,3,3,3,4,4,17,not_commented,Matched query: [how to handle shared costs with friends]. No transcript available.,,Automated API pull. Detected language: en.
Lex Fridman,OpenClaw: The Viral AI Agent that Broke the Internet - Peter Steinberger | Lex Fridman Podcast #491,https://www.youtube.com/watch?v=YFjfBk8HI5o,2026-02-12,medium,3,3,4,4,4,18,not_commented,Matched query: [how to handle shared costs with friends]. No transcript available.,,Automated API pull. Detected language: en.
Streamoslips,Share this to your friend #deaf #cost,https://www.youtube.com/watch?v=yQIYwTKvbug,2026-02-20,medium,3,3,4,4,4,18,not_commented,Matched query: [how to handle shared costs with friends]. No transcript available.,,Automated API pull. Detected language: en.
India To France,Student House Tour in Toulouse + Real Cost of Living (€650/month),https://www.youtube.com/watch?v=5MuFoA8sSuM,2026-03-25,medium,3,3,5,4,4,19,not_commented,Matched query: [shared house expenses]. No transcript available.,,Automated API pull. Detected language: en.
American Life Marathi Vibe,American House Ownership: Expenses That Surprise Everyone | USA Marathi Vlog|AmericanLifeMarathiVibe,https://www.youtube.com/watch?v=IDIr_u1vHG4,2026-03-13,high,3,5,5,4,4,21,not_commented,Matched query: [shared house expenses]. No transcript available.,,Automated API pull. Detected language: en.
Raghav Chadha Official,Raghav Chadha Proposes Joint Tax Filing for Married Couples in Parliament,https://www.youtube.com/watch?v=ReSZ-Nap6jk,2026-03-17,medium,3,3,5,4,4,19,not_commented,Matched query: [shared house expenses]. No transcript available.,,Automated API pull. Detected language: en.
House A2Z,100 Gaj Double Storey House Construction Cost 2026 | Real Case Study & Cost Cutting | House A2Z,https://www.youtube.com/watch?v=K5uSa95Gs1E,2026-03-05,medium,3,3,5,4,4,19,not_commented,Matched query: [shared house expenses]. No transcript available.,,Automated API pull. Detected language: en.
Kirrak Shopping,MK collection లో  తక్కువ ధరలో Pattu  చీరలు March Ending clearance sale pick any same cost Single cou,https://www.youtube.com/watch?v=FI6jWifssaU,2026-03-24,medium,3,3,5,4,4,19,not_commented,Matched query: [shared house expenses]. No transcript available.,,Automated API pull. Detected language: te.
Daily English Cafe,How to Talk About Living with Roommates in English | English Conversation Practice,https://www.youtube.com/watch?v=iD6SlkHU06o,2026-01-04,medium,4,3,3,4,4,18,not_commented,Matched query: [utilities with roommates]. No transcript available.,,Automated API pull. Detected language: en.
InterestingStories,My roommate charged me DOUBLE for utilities for 8 months 😳,https://www.youtube.com/watch?v=lJDtaJx94sI,2026-01-20,medium,3,3,3,4,4,17,not_commented,Matched query: [utilities with roommates]. No transcript available.,,Automated API pull. Detected language: en.
Wonderful Stories,"A few months after graduation, myroommates decided to kick me out of myown apartment. The only",https://www.youtube.com/watch?v=lkAM3jcpsCw,2026-01-15,medium,3,3,3,4,4,17,not_commented,Matched query: [utilities with roommates]. No transcript available.,,Automated API pull. Detected language: en.
Tales By Ar,"My Girlfriend Said: &quot;It&#39;s Not Breaking Up, It&#39;s A Pause.&quot; I Replied: &quot;Now You&#39;re My Roommate&quot;.",https://www.youtube.com/watch?v=usOzlUq6DNg,2026-02-20,medium,3,3,4,4,4,18,not_commented,Matched query: [utilities with roommates]. No transcript available.,,Automated API pull. Detected language: en.
Reddit Revenge,Roommate’s Secret Sublet Exposed by Utility Bill,https://www.youtube.com/watch?v=TdPz7308CKY,2025-12-29,medium,3,5,3,4,4,19,not_commented,Matched query: [utilities with roommates]. No transcript available.,,Automated API pull. Detected language: en.
MR KNOWN,Best AC Buying Guide 2026 | Monthy Electricity Bill | Inverter vs Non-Inverter | 3 Star vs 5 Star |,https://www.youtube.com/watch?v=4_A_tGg6HrE,2026-01-12,high,4,5,3,4,4,20,not_commented,Matched query: [how we split bills at home]. No transcript available.,,Automated API pull. Detected language: en.
BHAVANA STUDIOS,The Split | Malayalam Short Film | Alan Ehsan,https://www.youtube.com/watch?v=8Uf87LH5v54,2025-12-27,medium,3,5,3,4,4,19,not_commented,Matched query: [how we split bills at home]. No transcript available.,,Automated API pull. Detected language: en.
Chaitanya Reviews,Best AC For Home 2026  | Telugu 🔥,https://www.youtube.com/watch?v=chuHhKdq-SU,2026-03-14,medium,3,3,5,4,4,19,not_commented,Matched query: [how we split bills at home]. No transcript available.,,Automated API pull. Detected language: en.
VJ Telugu Vibes,household mapping splitting 2026,https://www.youtube.com/watch?v=BSr9VG_KzeA,2026-01-26,high,5,5,4,4,4,22,not_commented,Matched query: [how we split bills at home]. No transcript available.,,Automated API pull. Detected language: en.
Zack D. Films,How To Stack Pringles In A Circle 😮,https://www.youtube.com/watch?v=iCQH3kyiqnU,2026-01-21,medium,4,3,3,4,4,18,not_commented,Matched query: [how we split bills at home]. No transcript available.,,Automated API pull. Detected language: en.
The Nomadic Journey,Cost of Living in KOH SAMUI 2026 – Full Monthly Breakdown for Expats & Nomads,https://www.youtube.com/watch?v=UN_VXTbHzrI,2026-02-17,medium,3,3,4,4,4,18,not_commented,Matched query: [digital nomad travel budget]. No transcript available.,,Automated API pull. Detected language: en.
Tiny Detour,4 Digital Nomad Visas Tested | Thailand vs Malaysia vs Indonesia vs Vietnam,https://www.youtube.com/watch?v=frVU-oqxP1U,2026-03-12,medium,3,3,5,4,4,19,not_commented,Matched query: [digital nomad travel budget]. No transcript available.,,Automated API pull. Detected language: en.
Lucas World Travel,The Cost of Living in Cyprus - Our Monthly Expenses as Digital Nomads,https://www.youtube.com/watch?v=FsPSE0T9yhQ,2026-03-07,high,3,5,5,4,4,21,not_commented,Matched query: [digital nomad travel budget]. No transcript available.,,Automated API pull. Detected language: en.
Joose the Nomad,"Cost of Living in World&#39;s Most BEAUTIFUL City - Cape Town, South Africa",https://www.youtube.com/watch?v=0tqBqzCxUf0,2026-02-07,medium,3,3,4,4,4,18,not_commented,Matched query: [digital nomad travel budget]. No transcript available.,,Automated API pull. Detected language: en.
Abby and Gaz,SIARGAO Digital Nomad Life 🇵🇭 (NOT What You Expect),https://www.youtube.com/watch?v=33y89dB4DJM,2026-02-14,medium,3,3,4,4,4,18,not_commented,Matched query: [digital nomad travel budget]. No transcript available.,,Automated API pull. Detected language: en.
Bella LoRe,you’re going to move out in 2026 📦💫  *a guide for the overwhelmed 20-something*,https://www.youtube.com/watch?v=AR9_Vrk2lxY,2026-01-18,medium,4,3,3,4,4,18,not_commented,Matched query: [moving in with roommates checklist]. No transcript available.,,Automated API pull. Detected language: en.
Zhirelle,I&#39;M MOVING...INTO A HOUSE! (packing up my favorite apartment) MOVING DIARIES EP. 1!,https://www.youtube.com/watch?v=O8a_s8a0HZg,2026-01-30,medium,3,3,4,4,4,18,not_commented,Matched query: [moving in with roommates checklist]. No transcript available.,,Automated API pull. Detected language: en.
life and numbers,Decluttering Part 1: Preparing My House for Roommate Moving In (10 Days to Go!),https://www.youtube.com/watch?v=qnO2Flqc8o0,2026-01-08,medium,3,3,3,4,4,17,not_commented,Matched query: [moving in with roommates checklist]. No transcript available.,,Automated API pull. Detected language: en.
Daily Wisdom,"Renting 101: security deposits, move-in checklists, roommate agreements",https://www.youtube.com/watch?v=DJmsjU5NjXw,2026-03-15,medium,3,3,5,4,4,19,not_commented,Matched query: [moving in with roommates checklist]. No transcript available.,,Automated API pull. Detected language: en.
stories novel,"A few months after graduation, my roommates decided to kick me out of my own apartment. The only...",https://www.youtube.com/watch?v=-9PTVeQBytQ,2026-01-14,medium,3,3,3,4,4,17,not_commented,Matched query: [moving in with roommates checklist]. No transcript available.,,Automated API pull. Detected language: en.
EpikWorld.e,College Roomies Budget Blitz,https://www.youtube.com/watch?v=tdBb3_iUsiY,2026-02-18,medium,3,3,4,4,4,18,not_commented,Matched query: [student budget with roommates]. No transcript available.,,Automated API pull. Detected language: en.
Sukhraj singh ,Single vs Sharing Grocery 🍱 Cost in Cyprus 2026 | Real Monthly Expenses for Students🇨🇾,https://www.youtube.com/watch?v=vPky2KAm1YA,2026-03-17,high,3,5,5,4,4,21,not_commented,Matched query: [student budget with roommates]. No transcript available.,,Automated API pull. Detected language: en.
CeliaBourse,7 College Budget Hacks 2026 (Save $500/Month as Student),https://www.youtube.com/watch?v=6sN_6S_bj44,2026-03-06,medium,3,3,5,4,4,19,not_commented,Matched query: [student budget with roommates]. No transcript available.,,Automated API pull. Detected language: en.
Finance Fluent,Dorm Room Dollars: A Roommate Roadmap to Real Growth,https://www.youtube.com/watch?v=lDdGrDJJYjg,2026-01-10,medium,3,3,3,4,4,17,not_commented,Matched query: [student budget with roommates]. No transcript available.,,Automated API pull. Detected language: en.
Envelope Budget,Roommate bill splitting hack that ended 3 months of arguments,https://www.youtube.com/watch?v=ajWpeRKlJiI,2026-03-05,high,3,5,5,4,4,21,not_commented,Matched query: [how to handle money with roommates]. No transcript available.,"This is exactly the kind of roommate problem that gets expensive fast once nobody wants to be the person chasing the numbers. I’m building PaySplit to make shared expenses and balances visible without turning one roommate into the accountant. If anyone here is on Android and wants to test a simpler way to split bills, I’d really value candid feedback: https://play.google.com/store/apps/details?id=com.hanushh.paysplit",Automated API pull. Detected language: en. Drafted comment added 2026-04-21.
kingCarlX,We Set Up a Hidden Camera to See if His Roommate Is Stealing 👀,https://www.youtube.com/watch?v=BuTToIlRYJk,2026-03-10,medium,3,3,5,4,4,19,not_commented,Matched query: [how to handle money with roommates]. No transcript available.,,Automated API pull. Detected language: en.
smart ınvestor,Roommates and a Real Life Savings Plan for Shared Expenses,https://www.youtube.com/watch?v=SDK1k7zqzNI,2026-03-08,high,3,5,5,4,4,21,not_commented,Matched query: [how to handle money with roommates]. No transcript available.,,Automated API pull. Detected language: en.
Lorena Jusino,When this roommate owes you money #roommate #roommates #sketch,https://www.youtube.com/watch?v=aJy40G69OfM,2026-01-17,medium,3,3,3,4,4,17,not_commented,Matched query: [how to handle money with roommates]. No transcript available.,,Automated API pull. Detected language: en.
Landman Official,Ainsley Meets Her Roommate | Landman | Paramount+,https://www.youtube.com/watch?v=ryIeOxe9lBw,2026-01-16,medium,3,3,3,4,4,17,not_commented,Matched query: [asking roommates for money]. No transcript available.,,Automated API pull. Detected language: en.
爽劇追蹤 Cool Drama Tracking,"🔥🔥After becoming wealthy, I learn my ex gave birth to twins for me.#Chinese short drama",https://www.youtube.com/watch?v=Bvfh6HwdlEc,2026-03-22,medium,3,3,5,4,4,19,not_commented,Matched query: [asking roommates for money]. No transcript available.,,Automated API pull. Detected language: en.
The Ramsey Show Highlights,She Just Wants a Roommate with Benefits,https://www.youtube.com/watch?v=9NzL7tuKli4,2026-02-24,medium,3,3,5,4,4,19,not_commented,Matched query: [asking roommates for money]. No transcript available.,,Automated API pull. Detected language: en.
VibeNest,"My roommate stopped paying his share of the internet bill, laughing, “You can’t just cut the Wi-Fi..",https://www.youtube.com/watch?v=1CAM3C5Gy4c,2026-02-28,high,3,5,5,4,4,21,not_commented,Matched query: [roommate not paying their share]. No transcript available.,,Automated API pull. Detected language: en.
State Office,What Happens If a Roommate Moves Out?,https://www.youtube.com/watch?v=eD-2F7D_zrU,2026-01-23,medium,5,3,3,4,4,19,not_commented,Matched query: [roommate not paying their share]. No transcript available.,,Automated API pull. Detected language: en.
Court Archives,ROOMMATES FLEE Without Paying - Landlord Evicts The Guy Who PAID His Share,https://www.youtube.com/watch?v=VDcpQyOXv8o,2026-01-19,medium,3,3,3,4,4,17,not_commented,Matched query: [roommate not paying their share]. No transcript available.,,Automated API pull. Detected language: en.
"Vallone Law, PLLC",What if your roommate stops paying rent? 🤔,https://www.youtube.com/watch?v=LOBXMQlEekc,2025-12-31,medium,3,3,3,4,4,17,not_commented,Matched query: [roommate not paying their share]. No transcript available.,,Automated API pull. Detected language: en.
RevengeM,He Refused To Pay Rent — So I Quietly Took Away His Addiction,https://www.youtube.com/watch?v=g6y7pn_wY0I,2026-02-25,medium,3,3,5,4,4,19,not_commented,Matched query: [roommate not paying their share]. No transcript available.,,Automated API pull. Detected language: en.
LurkTale,I was excluded from a group trip I helped plan and pay for.,https://www.youtube.com/watch?v=qh8gpdjKJ6g,2026-01-25,medium,3,3,3,4,4,17,not_commented,Matched query: [group trip who pays for what]. No transcript available.,,Automated API pull. Detected language: en.
JEK TRAVELS,How to Travel Free or Get Paid by Booking Group Trips | JEK Travels Affiliate Program,https://www.youtube.com/watch?v=8vVlhHRx0VI,2026-01-28,medium,4,3,4,4,4,19,not_commented,Matched query: [group trip who pays for what]. No transcript available.,,Automated API pull. Detected language: en.
Aayu and Pihu Show,CHEATING ON TRIP | Ep 782 | Funny travel vlog and challenge | Aayu and Pihu Show,https://www.youtube.com/watch?v=ACqqEQAOtWA,2025-12-27,medium,3,3,3,4,4,17,not_commented,Matched query: [group trip who pays for what]. No transcript available.,,Automated API pull. Detected language: en.
Webnation Africa,"I Left the USA for Kenya — Now I Live Free on $2,000/Month",https://www.youtube.com/watch?v=463VpHueWms,2026-03-26,medium,3,3,5,4,4,19,not_commented,Matched query: [group trip who pays for what]. No transcript available.,,Automated API pull. Detected language: en.
Its Super Dave,How to get paid to travel with this courier company!￼,https://www.youtube.com/watch?v=pjuf30BOW8A,2026-02-16,medium,4,3,4,4,4,19,not_commented,Matched query: [group trip who pays for what]. No transcript available.,,Automated API pull. Detected language: en.
Saachi Goyal,How Much We Spent on a 9 Day Kerala Trip with a Toddler | Full Budget Breakdown #kerala #budget,https://www.youtube.com/watch?v=gaOsDmyRyKw,2026-03-06,medium,3,3,5,4,4,19,not_commented,Matched query: [splitting costs on vacation]. No transcript available.,,Automated API pull. Detected language: en.
Andika Fdl,Private Jeep vs Open Trip Bromo: Mana yang Paling Worth It? 🌋,https://www.youtube.com/watch?v=rT_ELMUJJ2A,2026-03-26,medium,3,3,5,4,4,19,not_commented,Matched query: [splitting costs on vacation]. No transcript available.,,Automated API pull. Detected language: en.
Saumya Singh ,"Switzerland Budget Trip💰Cost Split, Stay, Food, Swiss Pass, Train, Flight 🙌🏻 #shorts #ytshorts",https://www.youtube.com/watch?v=osZBkmWj4mc,2025-12-30,medium,3,5,3,4,4,19,not_commented,Matched query: [splitting costs on vacation]. No transcript available.,,Automated API pull. Detected language: en.
TravelSmarty,How to add expenses,https://www.youtube.com/watch?v=5f1pilF-4uY,2026-02-01,high,4,5,4,4,4,21,not_commented,Matched query: [splitting costs on vacation]. No transcript available.,,Automated API pull. Detected language: en.
PATNA LOCAL,Money problem 🤑  #friends #trip #funny  #meme #manali #viralshorts,https://www.youtube.com/watch?v=SE688hxBHIw,2026-01-09,medium,3,3,3,4,4,17,not_commented,Matched query: [friends trip money issues]. No transcript available.,,Automated API pull. Detected language: en.
Himalayan Region ,"No money, no problem, but without friends, we can&#39;t do everything. 🙏📿#friends #viral #reels #travel",https://www.youtube.com/watch?v=CKyxbNYDn2w,2026-01-15,medium,3,3,3,4,4,17,not_commented,Matched query: [friends trip money issues]. No transcript available.,,Automated API pull. Detected language: en.
MarkStories,Tag That Friend With Money Issues 😂 💸  #shorts #youtubeshorts #viral #trending #ai #friends #money,https://www.youtube.com/watch?v=edpk18dCQHM,2026-01-07,medium,3,3,3,4,4,17,not_commented,Matched query: [friends trip money issues]. No transcript available.,,Automated API pull. Detected language: en.
Dinu reddy01,PART-1….             Friendship & Money issue ​⁠#friends #money,https://www.youtube.com/watch?v=cFz7vJi8F5Q,2026-03-06,medium,3,3,5,4,4,19,not_commented,Matched query: [friends trip money issues]. No transcript available.,,Automated API pull. Detected language: en.
Mohit Chouhan62,"​💰 Account Balance Challenge: 3 Friends ko Call Kiya aur Jeete ₹15,150! 😱🔥 #viral #viral #shorts",https://www.youtube.com/watch?v=_uEaoUu5hds,2026-03-26,medium,3,3,5,4,4,19,not_commented,Matched query: [friends trip money issues]. No transcript available.,,Automated API pull. Detected language: en.
SYOK ,Travelling With Friends... How to Split Costs Without Making It Awkward | The Money Goal EP38,https://www.youtube.com/watch?v=JkmARutfAy0,2026-01-13,high,4,5,3,4,4,20,not_commented,Matched query: [how to split money with friends without awkwardness]. No transcript available.,,Automated API pull. Detected language: en.
Raunaq Rajani,Rich girl problems | RelationSh!t Advice ft. @GursimranKhamba @avantinagral @siddyshetty,https://www.youtube.com/watch?v=KUqEGz_RVNg,2026-03-26,medium,3,3,5,4,4,19,not_commented,Matched query: [how to split money with friends without awkwardness]. No transcript available.,,Automated API pull. Detected language: en.
BitBox,Moving In Together? How Couples Split Expenses Fairly | SplitEven,https://www.youtube.com/watch?v=Pg6fxC1o18w,2026-03-09,high,3,5,5,4,4,21,not_commented,Matched query: [how to split money with friends without awkwardness]. No transcript available.,,Automated API pull. Detected language: en.
English Duo,Paying with Friends: An Easy English Guide to Money Etiquette,https://www.youtube.com/watch?v=cjFiey8x6Uk,2026-01-13,medium,4,3,3,4,4,18,not_commented,Matched query: [how to split money with friends without awkwardness]. No transcript available.,,Automated API pull. Detected language: en.
FluentX English Channel,Daily English Conversation | How to Talk About Money in English (Without Being Awkward),https://www.youtube.com/watch?v=OhZQdkQgfL4,2026-01-26,medium,4,3,4,4,4,19,not_commented,Matched query: [how to split money with friends without awkwardness]. No transcript available.,,Automated API pull. Detected language: en.
BitBox,The Bill Just Arrived… and Everyone Looks Away 😅 | SplitEven   #dinnerwithfriends #billsplitting,https://www.youtube.com/watch?v=GjxYcBvKjQY,2026-03-12,high,3,5,5,4,4,21,not_commented,Matched query: [how to split money with friends without awkwardness]. No transcript available.,,Automated API pull. Detected language: en.
Stephen Castle,Check out Splitit - the easiest way to split bills with friends! https://splititnow.vercel.app,https://www.youtube.com/watch?v=RUotE02axo0,2026-01-10,high,5,5,3,4,4,21,not_commented,Matched query: [how to split money with friends without awkwardness]. No transcript available.,,Automated API pull. Detected language: en.
Speak Flow,"How to Talk About MONEY in English | Prices, Bills & Awkward Moments",https://www.youtube.com/watch?v=7Vf8m1ScFgY,2026-03-11,high,4,5,5,4,4,22,not_commented,Matched query: [how to split money with friends without awkwardness]. No transcript available.,,Automated API pull. Detected language: en.
Zack D. Films,How Does An Instant Crepe Maker Work 🤔,https://www.youtube.com/watch?v=y4-kk9sMGyE,2026-02-25,medium,3,3,5,4,4,19,not_commented,Matched query: [how to split money with friends without awkwardness]. No transcript available.,,Automated API pull. Detected language: en.
AI Talk English 🎓,How to Talk About Money in English - Real English Conversation,https://www.youtube.com/watch?v=vxR_9IzfZFA,2026-02-09,medium,4,3,4,4,4,19,not_commented,Matched query: [how to split money with friends without awkwardness]. No transcript available.,,Automated API pull. Detected language: en.
Dr. Yael R. Rosenstock Gonzalez,"Financial Boundaries, Friend Dates & Splitting the Bill 💸",https://www.youtube.com/watch?v=EtJh9B6Ia40,2026-02-23,high,3,5,4,4,4,20,not_commented,Matched query: [how to split money with friends without awkwardness]. No transcript available.,,Automated API pull. Detected language: en.
Kevin Langue,5 People Reveal Their Biggest Secret,https://www.youtube.com/watch?v=47bNa6KSOtU,2026-03-07,medium,3,3,5,4,4,19,not_commented,Matched query: [how to split money with friends without awkwardness]. No transcript available.,,Automated API pull. Detected language: en.
Zack D. Films,Why Puffy Jackets Are Dangerous In Car Seats 😨,https://www.youtube.com/watch?v=Ur80w3iJlXo,2026-01-06,medium,3,3,3,4,4,17,not_commented,Matched query: [how to split money with friends without awkwardness]. No transcript available.,,Automated API pull. Detected language: en.
Nick Invests,Your Friends Are Secretly Making You Poor (The Friendship Tax),https://www.youtube.com/watch?v=cCgJ_itCb-0,2026-01-31,medium,3,3,4,4,4,18,not_commented,Matched query: [how to split money with friends without awkwardness]. No transcript available.,,Automated API pull. Detected language: en.
Elaine Online | Your Digital & Affiliate Mentor,How to Make Money Online Without Being on Camera or Chasing People,https://www.youtube.com/watch?v=GuNALjhGcog,2026-01-01,medium,4,3,3,4,4,18,not_commented,Matched query: [how to split money with friends without awkwardness]. No transcript available.,,Automated API pull. Detected language: en.
