channel_name,video_title,video_url,upload_date,priority,intent_score,fit_score,freshness_score,promo_safety_score,android_score,total_score,status,why_it_fits,suggested_comment,notes
Tejas Patil,I Built a FREE Splitwise Alternative in 5 Mins,https://www.youtube.com/watch?v=x6cp2diEzu8,2026-03-25,high,5,5,5,4,4,23,competitor_promo,"Matched query: [""Splitwise"" alternative]. No transcript available.",,Automated API pull. Detected language: en. Rejected on 2026-04-20: creator is promoting a direct competitor build.
SnapTutorials,Splitwise App Review: Is It the Best Bill Splitting App?,https://www.youtube.com/watch?v=qyE_U1aaDE0,2026-02-02,high,5,5,4,4,4,22,not_commented,"Matched query: [""Splitwise"" alternative]. No transcript available.","Useful review, especially because the real pain usually starts once recurring shared expenses and reminders pile up. I built PaySplit after dealing with that exact roommate and friends problem myself. If anyone here wants a simple Android option for shared expenses, balances, and settle-ups, I’d genuinely value honest feedback: https://play.google.com/store/apps/details?id=com.hanushh.paysplit",Automated API pull. Detected language: en. Drafted comment added 2026-04-21.
info,TabMate — The Free Splitwise Alternative That Does More | Split Expenses App 2026,https://www.youtube.com/watch?v=ueyXqe1Eyf8,2026-02-19,high,5,5,4,4,4,22,competitor_promo,"Matched query: [""Splitwise"" alternative]. No transcript available.",,Automated API pull. Detected language: en. Rejected on 2026-04-20: direct competitor promo.
ARGameDevUK,Best FREE Splitwise alternative for Android 🚀 #Shorts,https://www.youtube.com/watch?v=ZbSyIDe90c4,2026-03-21,high,5,5,5,4,4,23,not_commented,"Matched query: [""Splitwise"" alternative]. No transcript available.",,Automated API pull. Detected language: en.
Chippy Split,Chippy Split: The Best Free Splitwise Alternative 2026 (Unlimited & Ad-Free),https://www.youtube.com/watch?v=LUR0V3EHWvg,2026-01-26,high,5,5,4,4,4,22,competitor_promo,"Matched query: [""Splitwise"" alternative]. No transcript available.",,Automated API pull. Detected language: en. Rejected on 2026-04-20: direct competitor promo.
How To Tutor,Splitwise App Review 2026: The Best Way to Split Bills?,https://www.youtube.com/watch?v=OUVQaLVHJTY,2026-01-26,high,5,5,4,4,4,22,not_commented,"Matched query: [""split bills"" app]. No transcript available.","Good breakdown of why bill-splitting apps feel helpful at first and annoying later when the flow gets bloated. Full disclosure: I’m building PaySplit for that exact use case. If anyone here is comparing options on Android, I’d love honest feedback on whether a lighter shared-expense tracker like this feels better: https://play.google.com/store/apps/details?id=com.hanushh.paysplit",Automated API pull. Detected language: en. Drafted comment added 2026-04-21.
Chippy Split,Chippy Split The #1 App to Split Bills with Friends #billsplitter #expensetracker #freeapps,https://www.youtube.com/watch?v=y8SZWmBs8dQ,2026-01-26,high,5,5,4,4,4,22,not_commented,"Matched query: [""split bills"" app]. No transcript available.",,Automated API pull. Detected language: en.
Paperclick,Splitwise vs Tricount vs SettleUp (2026) - Which One Is BEST?,https://www.youtube.com/watch?v=0yVwIGktgEs,2026-03-17,high,3,5,5,4,4,21,not_commented,"Matched query: [""split bills"" app]. No transcript available.","Useful comparison, especially because most people only notice the friction after a few shared expenses pile up. I’m building PaySplit for that exact use case. If anyone here wants an Android alternative focused on shared expenses, balances, and settle-ups, I’d genuinely love honest feedback: https://play.google.com/store/apps/details?id=com.hanushh.paysplit",Automated API pull. Detected language: en. Drafted comment added 2026-04-20.
YugTools,Room Rent & Bill Split Karne Ka Best App 📱 RoomLedger (Free) #YugTools,https://www.youtube.com/watch?v=6tzND1-drrI,2025-12-26,high,5,5,3,4,4,21,competitor_promo,Matched query: [roommate expenses app]. No transcript available.,,Automated API pull. Detected language: en. Rejected on 2026-04-20: direct competitor/app promo.
Money Manager official,Roommate Expenses Made Simple 🏠💸,https://www.youtube.com/watch?v=fFmpYM910os,2026-01-06,medium,3,5,3,4,4,19,not_commented,Matched query: [roommate expenses app]. No transcript available.,,Automated API pull. Detected language: en.
Money Manager official,Roommate Expenses Without the Drama 🏠💸,https://www.youtube.com/watch?v=awXyJ08m5lg,2026-01-06,medium,3,5,3,4,4,19,not_commented,Matched query: [roommate expenses app]. No transcript available.,,Automated API pull. Detected language: en.
Money Manager official,Roommate Expenses Without the Drama 🏠💸,https://www.youtube.com/watch?v=RA-lXVvzlw8,2026-01-06,medium,3,5,3,4,4,19,not_commented,Matched query: [roommate expenses app]. No transcript available.,,Automated API pull. Detected language: en.
Triplly,"Triplly is a smart group travel app for planning, chat, expenses, and shared memories.",https://www.youtube.com/watch?v=Yc5jzxA4NRI,2026-03-17,high,5,5,5,4,4,23,competitor_promo,Matched query: [travel expense sharing]. No transcript available.,,Automated API pull. Detected language: en. Rejected on 2026-04-20: direct competitor promo.
Motiv8Moments,🌏🔥 Family Trip Every Year – Worth It or Waste?,https://www.youtube.com/watch?v=LwHP65AdreQ,2026-03-26,medium,3,3,5,4,4,19,not_commented,Matched query: [travel expense sharing]. No transcript available.,,Automated API pull. Detected language: en.
outboundtravelers,Skip the Maldives! 🛑 Here’s how you can experience ultra-premium water villas for 5x CHEAPER! 🤯👇,https://www.youtube.com/watch?v=FyyoWcOjxgs,2026-03-21,medium,3,3,5,4,4,19,not_commented,Matched query: [travel expense sharing]. No transcript available.,,Automated API pull. Detected language: en.
Arya Kothari,Rent in Mumbai - EP 2 #home #fun #vlog #house,https://www.youtube.com/watch?v=l-gZe815JcM,2026-02-23,medium,3,3,4,4,4,18,not_commented,Matched query: [travel expense sharing]. No transcript available.,,Automated API pull. Detected language: en.
info,TabMate Referral Programme | Promote the Free Splitwise Alternative & Get Rewarded 2026,https://www.youtube.com/watch?v=Uynm8oPg3yM,2026-02-20,high,5,5,4,4,4,22,competitor_promo,Matched query: [free splitwise alternative]. No transcript available.,,Automated API pull. Detected language: en. Rejected on 2026-04-20: referral promo for a competitor.
talha uruç,Two Roommates Budget First Month Real World Wins,https://www.youtube.com/watch?v=V7mAvZf1cPg,2026-02-25,medium,3,3,5,4,4,19,not_commented,Matched query: [roommate budget tips]. No transcript available.,,Automated API pull. Detected language: en.
smart ınvestor,Roommate Budget Playbook A Real Life Shared Apartment,https://www.youtube.com/watch?v=qWLcOZo4O7g,2026-03-22,medium,3,3,5,4,4,19,not_commented,Matched query: [roommate budget tips]. No transcript available.,,Automated API pull. Detected language: en.
Budget Hacks,Roommate Budget Hack A Week of Tech-Savvy Savings,https://www.youtube.com/watch?v=PFUIHfof484,2026-02-27,medium,3,3,5,4,4,19,not_commented,Matched query: [roommate budget tips]. No transcript available.,,Automated API pull. Detected language: en.
EBUBEKİR ORHAN,The Roommates Budget Lab: Split Bills to Smart Habits,https://www.youtube.com/watch?v=zHJb3cygrdw,2026-03-23,high,3,5,5,4,4,21,not_commented,Matched query: [roommate budget tips]. No transcript available.,"You’re right that shared bills get messy fast when nobody wants to be the one keeping score. I built PaySplit for exactly that roommate problem. If anyone here is on Android and wants a simple way to track shared expenses, balances, and settle-ups, I’d love honest feedback: https://play.google.com/store/apps/details?id=com.hanushh.paysplit",Automated API pull. Detected language: en. Drafted comment added 2026-04-20.
JAGAL TEch,How To Split Rent With Friends on Flex App (2026 Edition) - Here&#39;s How You Can Do It // 2026 Edition,https://www.youtube.com/watch?v=WTLKdj4wNdM,2026-01-18,high,5,5,3,4,4,21,forced_fit,Matched query: [how to split rent with roommates]. No transcript available.,,"Automated API pull. Detected language: en. Rejected on 2026-04-20: another app tutorial, so a PaySplit comment would feel forced."
Kai Smart Investor,What &quot;Splitting Rent With a Roommate&quot; Actually Costs You,https://www.youtube.com/watch?v=Z8JgOdteGi8,2026-02-25,high,3,5,5,4,4,21,not_commented,Matched query: [how to split rent with roommates]. No transcript available.,"This is a good reminder that cheap rent stops being cheap once utilities and uneven sharing start creeping in. I’m building PaySplit after running into the same roommate math problem myself. If anyone here wants an Android app for exact splits, recurring bills, and visible balances, I’d really value honest feedback: https://play.google.com/store/apps/details?id=com.hanushh.paysplit",Automated API pull. Detected language: en. Drafted comment added 2026-04-20.
Matthew Coast,"Ladies, if your man makes you split rent, he&#39;s your roommate. If he makes you plan ev...",https://www.youtube.com/watch?v=tioIl4xeuIE,2026-01-18,medium,3,5,3,4,4,19,not_commented,Matched query: [how to split rent with roommates]. No transcript available.,,Automated API pull. Detected language: en.
Beyond Stories,My Roommate Thought Rent Was One-Time Payment 😭#shorts #viral#roommatestories,https://www.youtube.com/watch?v=C7uYG7SRXlc,2026-02-25,medium,3,3,5,4,4,19,not_commented,Matched query: [how to split rent with roommates]. No transcript available.,,Automated API pull. Detected language: en.
Savvy Gaby,"ANSWERING YOUR QUESTIONS | moving to a new city, living with 5 roommates + my 2026 life plans",https://www.youtube.com/watch?v=JM8bJ9ZEE38,2026-03-15,medium,3,3,5,4,4,19,not_commented,Matched query: [moving to a new city roommates]. No transcript available.,,Automated API pull. Detected language: en.
Just Roommates,We Unlocked a New City,https://www.youtube.com/watch?v=Us0eUzGvkyI,2026-02-10,medium,3,3,4,4,4,18,not_commented,Matched query: [moving to a new city roommates]. No transcript available.,,Automated API pull. Detected language: en.
Lil Peeva,affordable apartment hunting in nyc (under $1700),https://www.youtube.com/watch?v=MsOvuzR7m0o,2025-12-28,medium,3,3,3,4,4,17,not_commented,Matched query: [moving to a new city roommates]. No transcript available.,,Automated API pull. Detected language: en.
World ON,"Bengaluru Woman Reveals ₹62,150 Cost Of Moving From PG To Flat",https://www.youtube.com/watch?v=4TKVRHzlH-4,2026-03-11,medium,3,3,5,4,4,19,not_commented,Matched query: [moving to a new city roommates]. No transcript available.,,Automated API pull. Detected language: en.
Howdy Apartments,14 Days of New City Tips — Day 9: Finding a Roommate,https://www.youtube.com/watch?v=GdpJnVt-otM,2026-03-04,medium,3,3,5,4,4,19,not_commented,Matched query: [moving to a new city roommates]. No transcript available.,,Automated API pull. Detected language: en.
Living Guide,"NYC Rent Prices 2026 + Full Monthly Expenses Manhattan, Brooklyn, Queens",https://www.youtube.com/watch?v=rObJ4vwWfHg,2026-02-28,high,3,5,5,4,4,21,not_commented,Matched query: [city life roommate expenses]. No transcript available.,,Automated API pull. Detected language: en.
Mandeep Singapore,Singapore Rental Cost of living For single Person ,https://www.youtube.com/watch?v=dmuayDe56JE,2026-02-11,medium,3,3,4,4,4,18,not_commented,Matched query: [city life roommate expenses]. No transcript available.,,Automated API pull. Detected language: en.
Living Guide,Cost of Living in Los Angeles 2026: Real Rent Prices + Monthly Expense Breakdown,https://www.youtube.com/watch?v=-tX7XnRJHWs,2026-03-01,high,3,5,5,4,4,21,not_commented,Matched query: [city life roommate expenses]. No transcript available.,,Automated API pull. Detected language: en.
JNV SHIVPURI ,Share with Your friends/ Hostel Life / Memory #jnv #nvs #kvs #emrs #navodayaexam #entranceexam,https://www.youtube.com/watch?v=Bufl45Arvrk,2026-01-14,medium,3,3,3,4,4,17,not_commented,Matched query: [hostel expenses with friends]. No transcript available.,,Automated API pull. Detected language: en.
Akshat Parashar,A Final Goodbye to the hostel where it all began,https://www.youtube.com/watch?v=EsRVJuibsnY,2026-02-05,medium,3,3,4,4,4,18,not_commented,Matched query: [hostel expenses with friends]. No transcript available.,,Automated API pull. Detected language: en.
JNV SHIVPURI ,Happiness is there #navodaya #nvs #kvs #emrs #jnv #jnvst #jnvshivpuri #entranceexam #navodayaexam,https://www.youtube.com/watch?v=cSt31xp0Q4A,2025-12-27,medium,5,3,3,4,4,19,not_commented,Matched query: [hostel expenses with friends]. No transcript available.,,Automated API pull. Detected language: en.
Love Paradox - CJM,Poor Girl Accidentally Entered A Noble🔥School But Campus King Fall For Her😍Korean Chinese DramaHindi,https://www.youtube.com/watch?v=QYk5hq9efWY,2025-12-30,medium,3,3,3,4,4,17,not_commented,Matched query: [hostel expenses with friends]. No transcript available.,,Automated API pull. Detected language: en.
Sarcastic Sai,Andharam ila irukkupoyam enti #friends #travel #funny #trending #shorts,https://www.youtube.com/watch?v=Ap5g5SbrnNM,2026-02-09,medium,3,3,4,4,4,18,not_commented,Matched query: [hostel expenses with friends]. No transcript available.,,Automated API pull. Detected language: en.
shiksha.com,Delhi University Fee Structure 2026 | DU Fees + Hostel + PG Total Cost Explained #delhiuniversity,https://www.youtube.com/watch?v=NH4JQqJVKJo,2026-03-15,medium,3,3,5,4,4,19,not_commented,Matched query: [college hostel budget]. No transcript available.,,Automated API pull. Detected language: en.
MediPedia Overseas,"Top 10 MBBS Universities in Russia 2026 | Complete Budget, MBBS Fees, Hostels & NMC Guidelines",https://www.youtube.com/watch?v=oug9UHmQhP8,2026-03-06,high,4,3,5,4,4,20,not_commented,Matched query: [college hostel budget]. No transcript available.,,Automated API pull. Detected language: en.
House Of Ambitions,"Delhi Me Padhne Ka Kharcha 2026 | Hostel, PG, Food, Travel + College Fees Breakdown",https://www.youtube.com/watch?v=Kpopjk-RkPg,2026-03-24,medium,3,3,5,4,4,19,not_commented,Matched query: [college hostel budget]. No transcript available.,,Automated API pull. Detected language: en.
TrendLok,Budget 2026: FM Proposes 5 University Townships & Girls’ Hostels in Every District,https://www.youtube.com/watch?v=Bca3Gm6WCiY,2026-02-01,medium,3,3,4,4,4,18,not_commented,Matched query: [college hostel budget]. No transcript available.,,Automated API pull. Detected language: en.
Srishty Khera,Low Budget Private Medical College in India MBBS in Kerala 2026 Fees & Cut off #neet2026 #neetug2026,https://www.youtube.com/watch?v=U9Dp6AKK5Uw,2026-01-24,medium,3,3,3,4,4,17,not_commented,Matched query: [college hostel budget]. No transcript available.,,Automated API pull. Detected language: en.
REDGOTRIP,Kashmir group tour Package | Kashmir family budget trip package | Kashmir couple trip package |,https://www.youtube.com/watch?v=Em-MK5A5PzI,2026-03-23,medium,3,3,5,4,4,19,not_commented,Matched query: [group trip budget]. No transcript available.,,Automated API pull. Detected language: en.
tarun vlogs ki duniya,Delhi to Kasol by Travel Company | ₹7k–₹10k Budget Trip | Complete Guide | Tarun vlogs ki duniya,https://www.youtube.com/watch?v=TJyonEYsIdg,2026-01-06,medium,4,3,3,4,4,18,not_commented,Matched query: [group trip budget]. No transcript available.,,Automated API pull. Detected language: en.
Travel To Uttarakhand with sanjay ,Chardham Yatra Budget Package 2026|Chardham Yatra Group package 2026। Chardham yatra Pckage Cost ,https://www.youtube.com/watch?v=8BCmnNPerm8,2026-01-10,medium,3,3,3,4,4,17,not_commented,Matched query: [group trip budget]. No transcript available.,,Automated API pull. Detected language: hi.
Ankush Chetal,INDIA TO BALI INDONESIA in 2026| BUDGET TRIP | FLIGHT HOTEL VISA all included,https://www.youtube.com/watch?v=ynY68suHddo,2026-01-06,medium,3,3,3,4,4,17,not_commented,Matched query: [group trip budget]. No transcript available.,,Automated API pull. Detected language: en.
Gaurav Deswal,"Ep.6 Ladakh Bike Ride in ₹15,000 | Complete Budget & Itinerary",https://www.youtube.com/watch?v=pw_WgnlY55o,2026-02-08,medium,3,3,4,4,4,18,not_commented,Matched query: [group trip budget]. No transcript available.,,Automated API pull. Detected language: en.
Btech Huduga Guru,Low Budget Tirupati Trip 😲 | Friends ಜೊತೆ Trip Kannada Vlog,https://www.youtube.com/watch?v=sGqdWp0Kjjo,2026-03-25,medium,3,3,5,4,4,19,not_commented,Matched query: [friends trip expenses]. No transcript available.,,Automated API pull. Detected language: kn.
CA Guru Ji,Salary 💸पर बचेगा 😱 ज्यादा Tax | New Exemption Limits as per New Tax Rules 2026 #tax,https://www.youtube.com/watch?v=wX-LJKZbVDA,2026-03-26,medium,3,3,5,4,4,19,not_commented,Matched query: [group trip etiquette money]. No transcript available.,,Automated API pull. Detected language: hi.
Mundhe Banni Podcast,"Borrowed Money From Wife to Buy a Fridge — Now Manages ₹2000 Crore | Deepak Shenoy, Capitalmind",https://www.youtube.com/watch?v=IMlMUIZ5VTg,2026-03-26,medium,3,3,5,4,4,19,not_commented,Matched query: [group trip etiquette money]. No transcript available.,,Automated API pull. Detected language: en.
FinTaxPro,100% Tax on cash transactions | New Cash Transaction Rules from 1 April 2026,https://www.youtube.com/watch?v=uvF7erlcOuI,2026-03-24,medium,3,3,5,4,4,19,not_commented,Matched query: [group trip etiquette money]. No transcript available.,,Automated API pull. Detected language: en.
Business Standard,"New income-tax rules 2026 notified: What changes for your salary, HRA, EV perks and compliance",https://www.youtube.com/watch?v=8fomjDENVAs,2026-03-23,medium,3,3,5,4,4,19,not_commented,Matched query: [group trip etiquette money]. No transcript available.,,Automated API pull. Detected language: en.
The Trade Room,The Funded Room Rules Explained || No Hidden Rules || 0 Payout Denial || Part-1,https://www.youtube.com/watch?v=2SsAXm9Hnis,2026-03-20,medium,3,3,5,4,4,19,not_commented,Matched query: [group trip etiquette money]. No transcript available.,,Automated API pull. Detected language: en.
Dare To Improve,roommate ruins $825m lottery dream | Subscribe for more #motivation 😊👍,https://www.youtube.com/watch?v=6uSQiCI1Ohc,2026-03-11,medium,3,3,5,4,4,19,not_commented,Matched query: [money etiquette with roommates]. No transcript available.,,Automated API pull. Detected language: en.
Honey Drop Dramas,"He proposed to my best friend in public, I married a professor CEO instead—got spoiled beyond limits",https://www.youtube.com/watch?v=xL4ueE-K-GY,2025-12-30,medium,3,3,3,4,4,17,not_commented,Matched query: [money etiquette with roommates]. No transcript available.,,Automated API pull. Detected language: en.
Screen Rewind ​声影漫游,ENG SUB 【沙雕動畫 】🔥《仅退款风云》室友沉迷“仅退款”，从衣服到手机无所不贪！她拿我账号惹祸，害我被全校唾弃—这次我让她全家赔光！#爽文#沙雕動畫#打脸爽剧#ScreenRewind声影漫游,https://www.youtube.com/watch?v=Z21Q34HFr9Q,2026-03-26,medium,3,3,5,4,4,19,not_commented,Matched query: [money etiquette with roommates]. No transcript available.,,Automated API pull. Detected language: en.
We Still Hustle Daily 2,Her College Roommate Started Setting Rules For All The Other Roommates & Taking Up Most The Space,https://www.youtube.com/watch?v=H7m5KSIqIIc,2026-03-02,medium,3,3,5,4,4,19,not_commented,Matched query: [money etiquette with roommates]. No transcript available.,,Automated API pull. Detected language: en.
Room of Wisdom,5 Money Rules that changed my Life since 2023,https://www.youtube.com/watch?v=5kDwVq-4xYg,2026-02-14,medium,3,3,4,4,4,18,not_commented,Matched query: [money etiquette with roommates]. No transcript available.,,Automated API pull. Detected language: en.
Instasttories,"He Never Paid $8,000 in Rent. Then Asked Me to Pay His Bail. #karma #storytime",https://www.youtube.com/watch?v=QUCjCYbSP2Q,2026-02-03,medium,3,3,4,4,4,18,not_commented,Matched query: [roommate money boundaries]. No transcript available.,,Automated API pull. Detected language: en.
smart ınvestor,Boundaries and Budget Wins in a Shared Apartment,https://www.youtube.com/watch?v=dDSBZokkQKo,2026-02-19,medium,3,3,4,4,4,18,not_commented,Matched query: [roommate money boundaries]. No transcript available.,,Automated API pull. Detected language: en.
𝐖𝐞𝐚𝐥𝐭𝐡𝐲 𝐀𝐦𝐞𝐫𝐢𝐜𝐚𝐧𝐬,4 Reasons Why Roommates in Your 40s Are the Smart Money Move 💸🏠,https://www.youtube.com/watch?v=s76_8SNN5Mk,2026-01-11,medium,3,3,3,4,4,17,not_commented,Matched query: [roommate money boundaries]. No transcript available.,,Automated API pull. Detected language: en.
Money Mind Set Bro,"I Got A Roommate 8 Months - Saved $4,800 🏠💰 #shorts #roommate #savemoney #rentcheap",https://www.youtube.com/watch?v=MYlUJoh9v1I,2026-02-05,medium,3,3,4,4,4,18,not_commented,Matched query: [roommate money boundaries]. No transcript available.,,Automated API pull. Detected language: en.
Life Lab,Living With a Roommate Is Harder Than You Think,https://www.youtube.com/watch?v=ysIODDcTNOo,2026-01-17,medium,3,3,3,4,4,17,not_commented,Matched query: [roommate money boundaries]. No transcript available.,,Automated API pull. Detected language: en.
KreekCraft,How To Get Roblox Chat Back,https://www.youtube.com/watch?v=aajit9VVkmk,2026-02-11,medium,4,3,4,4,4,19,false_positive,Matched query: [how to talk about bills with roommates]. No transcript available.,,Automated API pull. Detected language: en. Rejected on 2026-04-20: unrelated gaming result.
CNA,How to protect yourself when lending money to family and friends | Money Talks,https://www.youtube.com/watch?v=o1BwT_XSwCE,2026-03-10,high,4,3,5,4,4,20,not_commented,Matched query: [how to talk about bills with roommates]. No transcript available.,"This is a useful breakdown because the awkward part is usually the conversation, not just the money itself. I’m building PaySplit for exactly that kind of shared-expense situation, and it only helps if it reduces the need for repeated reminders. If anyone here is on Android, I’d really value feedback on whether it makes lending and settling up with friends feel less awkward: https://play.google.com/store/apps/details?id=com.hanushh.paysplit",Automated API pull. Detected language: en. Drafted comment added 2026-04-20.
XYZ Gamerz,MY TALKING TOM FRIENDS GAMEPLAY UNLIMITED MONEY 💰 🤑 💸 #youtubevideo #gaming #mytalkingtom #explore,https://www.youtube.com/watch?v=jAL7ibiCwO4,2026-01-27,medium,3,3,4,4,4,18,not_commented,Matched query: [how to talk about bills with roommates]. No transcript available.,,Automated API pull. Detected language: en.
Eagle 0.1,Friend vs  Money #shortvideo #friends #money,https://www.youtube.com/watch?v=ZTZB3AxI41A,2026-02-13,medium,3,3,4,4,4,18,not_commented,Matched query: [how to talk about bills with roommates]. No transcript available.,,Automated API pull. Detected language: en.
The Arun Pandit Show Podcast ,Vrishabh Rashi 2026: How to Avoid Money Loss & Family Fights #shorts #astroarunpandit,https://www.youtube.com/watch?v=o6q22vZoc6Y,2026-03-26,high,4,3,5,4,4,20,false_positive,Matched query: [how to avoid money fights on a trip]. No transcript available.,,Automated API pull. Detected language: en. Rejected on 2026-04-20: astrology result from a noisy query.
"Rena Malik, M.D.",Why Couples Fight About Money… Then Stop Having Sex,https://www.youtube.com/watch?v=9ERPcBZRLf8,2026-03-20,medium,3,3,5,4,4,19,not_commented,Matched query: [how to avoid money fights on a trip]. No transcript available.,,Automated API pull. Detected language: en.
TODAY,"How to Fight Unexpected Fees on Travel, Utility Bills, More",https://www.youtube.com/watch?v=qHkzxpNOR5U,2026-03-23,high,4,5,5,4,4,22,not_commented,Matched query: [how to avoid money fights on a trip]. No transcript available.,"Unexpected fees are exactly the kind of thing that turn a trip or shared apartment into a weird money conversation afterward. I’m building PaySplit for that problem so people can log shared costs, see balances, and settle up without chasing each other manually. If anyone here is on Android, I’d genuinely love feedback on whether it feels simpler than using notes or spreadsheets: https://play.google.com/store/apps/details?id=com.hanushh.paysplit",Automated API pull. Detected language: en. Drafted comment added 2026-04-20.
Him-eesh Madaan Clips,Family Business Fights? Here’s How We Avoid Them| ft. Savji Bhai Dholakia | Him eesh Madaan Clips,https://www.youtube.com/watch?v=4hC8-VFbHzk,2026-02-26,medium,3,3,5,4,4,19,not_commented,Matched query: [how to avoid money fights on a trip]. No transcript available.,,Automated API pull. Detected language: en.
AImagine,Stop fighting your spending habits do this instead #MoneySavingTips #SmartSavings,https://www.youtube.com/watch?v=ziWGG7HnQ0o,2026-03-10,medium,3,3,5,4,4,19,not_commented,Matched query: [how to avoid money fights on a trip]. No transcript available.,,Automated API pull. Detected language: en.
Yuvarani,New Airline Rules 2026 You Must Know Before Flying  #yuvarani #flightrules,https://www.youtube.com/watch?v=n7y-D-V470w,2026-03-26,medium,3,3,5,4,4,19,not_commented,Matched query: [travel etiquette with friends money]. No transcript available.,,Automated API pull. Detected language: en.
The Finance Edit,Money Etiquette With FRIENDS #shorts #moneyhabits #personalfinance #finance101,https://www.youtube.com/watch?v=C-LARbdGSjI,2026-01-05,medium,3,3,3,4,4,17,not_commented,Matched query: [travel etiquette with friends money]. No transcript available.,,Automated API pull. Detected language: en.
