channel_name,video_title,video_url,upload_date,priority,intent_score,fit_score,freshness_score,promo_safety_score,android_score,total_score,status,why_it_fits,suggested_comment,notes
David Gonos,✨How to Answer &#39;What&#39;s Your Most Valuable Card?&#39; Without Awkwardness✨,https://www.youtube.com/watch?v=MKmaFWY5La0,2026-03-25,high,4,3,5,4,4,20,not_commented,Matched query: [how to split money with friends without awkwardness]. No transcript available.,,Automated API pull. Detected language: en.
English Daily,How to Divide the Check with Friends in America — Easy English for International Visitors #english,https://www.youtube.com/watch?v=SeYhMC-fT0E,2026-03-21,high,4,3,5,4,4,20,not_commented,Matched query: [how to split money with friends without awkwardness]. No transcript available.,,Automated API pull. Detected language: en.
Simran Kaur ,The Hidden Money Conversation Every Couple Needs,https://www.youtube.com/watch?v=oR5eQnkWDys,2026-01-26,medium,3,3,4,4,4,18,not_commented,Matched query: [how to split money with friends without awkwardness]. No transcript available.,,Automated API pull. Detected language: en.
Ram N Java,Split Bills with Friends Using Google Pay,https://www.youtube.com/watch?v=A5I80iYmf6A,2026-02-05,high,3,5,4,4,4,20,not_commented,Matched query: [how to split money with friends without awkwardness]. No transcript available.,,Automated API pull. Detected language: en.
破晓动漫社 Dawn Anime Club,MULTISUB📢新番上线《奇遇翻盘》第1~98集丨陈凡送外卖时意外被女富豪撞倒，机缘巧合进入其酒店，凭真诚与能力化解派系内斗、挫败阴谋，完成底层逆袭，事业爱情双丰收！#漫剧 #破晓动漫社,https://www.youtube.com/watch?v=Vk-u9Q-yhqY,2026-03-26,medium,3,3,5,4,4,19,not_commented,Matched query: [how to split money with friends without awkwardness]. No transcript available.,,Automated API pull. Detected language: en.
BigDawsFan,When Your Neighbor Crashes Your Netflix & Chill 😱🤣#viral #explore #trending,https://www.youtube.com/watch?v=p2p-_EMCnBo,2025-12-30,medium,3,3,3,4,4,17,not_commented,Matched query: [how to split money with friends without awkwardness]. No transcript available.,,Automated API pull. Detected language: en.
Sanemi Recap,"She Worked Hard To Earn Money So She Could Leave Her Home, But A Tyrant Adopted Her",https://www.youtube.com/watch?v=824YOzeriFw,2026-03-25,medium,3,3,5,4,4,19,not_commented,Matched query: [how to split money with friends without awkwardness]. No transcript available.,,Automated API pull. Detected language: en.
SplitVors,"SplitVors - Bill Splitter, Expense Tracker App and More",https://www.youtube.com/watch?v=y-4Rhs_HbuQ,2026-01-30,high,5,5,4,4,4,22,not_commented,Matched query: [how to split money with friends without awkwardness]. No transcript available.,,Automated API pull. Detected language: en.
The Spill Bee,TARA SUTARIA & AP DHILLON WEIRD MOMENTS DURING CONCERT: VEER PAHARIYA WAS UPSET,https://www.youtube.com/watch?v=OnMlYA9-7fE,2025-12-28,medium,3,3,3,4,4,17,not_commented,Matched query: [how to split money with friends without awkwardness]. No transcript available.,,Automated API pull. Detected language: en.
Mann Ka Meter,The Awkward Silence... When Friends Talk Stocks & You Feel Dumb🤪,https://www.youtube.com/watch?v=S56ikFrw1n0,2025-12-30,medium,3,3,3,4,4,17,not_commented,Matched query: [how to split money with friends without awkwardness]. No transcript available.,,Automated API pull. Detected language: en.
Netflix,here are 5 things you need to remember ahead of #Bridgerton Season 4,https://www.youtube.com/watch?v=yXX8D_VP4Fg,2026-01-28,medium,3,3,4,4,4,18,not_commented,Matched query: [how to not be the one who tracks money]. No transcript available.,,Automated API pull. Detected language: en.
Tech feel india,🔥Indian Oil app se indane gas cylinder booking kaise kare ✅! how to book indane gas cylinder Online,https://www.youtube.com/watch?v=KlRK7XLCLxs,2026-03-15,high,5,3,5,4,4,21,not_commented,Matched query: [how to not be the one who tracks money]. No transcript available.,,Automated API pull. Detected language: en.
PsychUnboxed,Money Follows This (Not Effort) – Machiavelli,https://www.youtube.com/watch?v=Sbf3g4rx-qc,2026-01-08,medium,3,3,3,4,4,17,not_commented,Matched query: [how to not be the one who tracks money]. No transcript available.,,Automated API pull. Detected language: en.
IND Hindi Tech,Online Gas Booking Home Delivery New update | Online LPG Gas Booking new app | Lpg gas cylinder book,https://www.youtube.com/watch?v=0HN6EISXc78,2026-03-18,high,5,3,5,4,4,21,not_commented,Matched query: [how to not be the one who tracks money]. No transcript available.,,Automated API pull. Detected language: en.
Simply Solved,How To Split A Payment In Square POS App [NEW 2026 Guide],https://www.youtube.com/watch?v=k-1pKGCFFJc,2026-03-08,high,5,5,5,4,4,23,not_commented,"Matched query: [""split bills"" app]. No transcript available.",,Automated API pull. Detected language: en.
Lorence Laudenio Digital,[ENLGISH] How to SPLIT Group Travel Expense in Google Sheet! *EASY*,https://www.youtube.com/watch?v=8910JnXZwLg,2026-03-17,high,4,5,5,4,4,22,not_commented,Matched query: [travel expense sharing]. No transcript available.,,Automated API pull. Detected language: en.
MJ Islam Vlog,My Travel Cost 😱 | Real Expenses |,https://www.youtube.com/watch?v=_dQHXBG-o_A,2026-01-29,high,3,5,4,4,4,20,not_commented,Matched query: [travel expense sharing]. No transcript available.,,Automated API pull. Detected language: en.
Isha Gour,Zero Budget Salon at Flat! 🏠✨ DIY Hair Care Day #hostellife #friends #foryou #minivlog #flatmates,https://www.youtube.com/watch?v=K_Qqjw-jxJw,2026-01-25,medium,3,3,3,4,4,17,not_commented,Matched query: [roommate budget tips]. No transcript available.,,Automated API pull. Detected language: en.
Lalit Singh Solanki,"I Found India’s Most Luxurious Hostel for Only ₹400! 😱 | The Hosteller Bam Jaipur , Hawa Mahal ",https://www.youtube.com/watch?v=W-ztfrrVdr0,2026-01-22,medium,3,3,3,4,4,17,not_commented,Matched query: [hostel expenses with friends]. No transcript available.,,Automated API pull. Detected language: en.
Collegedekho with Hritik,Jagsom Bangalore - My Friend Adarsh - 1st Year Student - PGDM Fee - 18L Fee (Including Hostel)✔️,https://www.youtube.com/watch?v=8RcHx8ezEEE,2026-01-18,medium,3,3,3,4,4,17,not_commented,Matched query: [hostel expenses with friends]. No transcript available.,,Automated API pull. Detected language: en.
Aditya the Trailblazer,I Spent How Much in Thailand? Actual Costs Revealed,https://www.youtube.com/watch?v=n7MMU5_m0wQ,2026-02-12,medium,3,3,4,4,4,18,not_commented,Matched query: [hostel expenses with friends]. No transcript available.,,Automated API pull. Detected language: en.
Nayana Vlogs,🩵ಈ ಬಾರಿ Group Tour ಇತರ ಆಗುತ್ತೆ ಅಂತ ಅನ್ಕೋಲಿಲ್ಲ😍Fully Packed Entertainment💃Honnavara Group Tour-Part 1,https://www.youtube.com/watch?v=d28j3Qx4CYQ,2026-03-26,medium,3,3,5,4,4,19,not_commented,Matched query: [group trip budget]. No transcript available.,,Automated API pull. Detected language: kn.
Heaven Explorer,Summerக்கு Friends & FamilyஆTRIP பண்ணிட்டிருக்கீங்களா?,https://www.youtube.com/watch?v=AxOzaX39vn8,2026-03-23,medium,3,3,5,4,4,19,not_commented,Matched query: [friends trip expenses]. No transcript available.,,Automated API pull. Detected language: ta.
Pranav Raundal,Budget trip expenses meme 🤣 #budgettrip  #friendstrip #meme #tripexpences #shorts #pranav_raundal,https://www.youtube.com/watch?v=3vHuLLuuQf4,2026-01-02,medium,3,5,3,4,4,19,not_commented,Matched query: [friends trip expenses]. No transcript available.,,Automated API pull. Detected language: en.
RB toons,When Friends Make a Trip Plan in Pure Hindi 😂 #shorts #funny #comedy #cartoon #rbtoons #tweencraft,https://www.youtube.com/watch?v=h2O1PuzSMsM,2026-03-01,medium,3,3,5,4,4,19,not_commented,Matched query: [friends trip expenses]. No transcript available.,,Automated API pull. Detected language: en.
The Film Theorists,The Friends Apartment Cost HOW MUCH!?,https://www.youtube.com/watch?v=RhOpK_vD8tQ,2026-01-01,medium,3,3,3,4,4,17,not_commented,Matched query: [friends trip expenses]. No transcript available.,,Automated API pull. Detected language: en.
Paradise Yatra,Andaman Nicobar Tour Package | 5night 6days Andaman Tour | Andaman Trip Cost #andamantrip #andaman,https://www.youtube.com/watch?v=b27r8ZutRLc,2026-01-05,medium,3,3,3,4,4,17,not_commented,Matched query: [friends trip expenses]. No transcript available.,,Automated API pull. Detected language: en.
Immortal Fame,After Trip Reality – Group Expense Discussion Be Like 😅 | Friends Trip Funny Moments,https://www.youtube.com/watch?v=7WxMuRmLO7M,2026-03-02,high,3,5,5,4,4,21,not_commented,Matched query: [friends trip expenses]. No transcript available.,,Automated API pull. Detected language: en.
KNN NEWS,해외여행 준비 다 했더니 친구가 보낸 &#39;뭉클한 보상&#39;?/ KNN,https://www.youtube.com/watch?v=kYcrzrZMGAI,2026-03-19,medium,3,3,5,4,4,19,not_commented,Matched query: [friends trip expenses]. No transcript available.,,Automated API pull. Detected language: en.
Stories Recap,Suing a Friend for Bali Travel Costs,https://www.youtube.com/watch?v=4_2Y3y8DNs8,2026-02-15,medium,3,3,4,4,4,18,not_commented,Matched query: [friends trip expenses]. No transcript available.,,Automated API pull. Detected language: en.
Trippit Planners,Trip Ke Baad Budget Ka Breakdown 😭💸,https://www.youtube.com/watch?v=8kT-m_l2EAI,2026-02-13,medium,3,3,4,4,4,18,not_commented,Matched query: [friends trip expenses]. No transcript available.,,Automated API pull. Detected language: en.
Dimaak Tours,Sri Lanka Road Trip 10 Days Itinerary | Cost Breakdown 2026 #travelwithdimaak #srilanka,https://www.youtube.com/watch?v=GAyEJebALXs,2026-03-26,medium,3,3,5,4,4,19,not_commented,Matched query: [friends trip expenses]. No transcript available.,,Automated API pull. Detected language: en.
Finance with Faiyaz,Why Trips With Friends Get Awkward (And How to Fix It) #budgettravel #travelwithfriends #budgeting,https://www.youtube.com/watch?v=8dRvMghP4HE,2026-03-03,high,4,3,5,4,4,20,not_commented,Matched query: [friends trip expenses]. No transcript available.,"This is exactly why group trips go sideways so fast: the awkwardness starts before anyone settles the costs cleanly. Full disclosure: I’m building PaySplit for that specific shared-expense mess. If anyone here is on Android and wants a lightweight way to track trip spending and settle up fairly, I’d appreciate honest feedback: https://play.google.com/store/apps/details?id=com.hanushh.paysplit",Automated API pull. Detected language: en. Drafted comment added 2026-04-21.
Triggered Insaan,Guess the Secret Word and I will Buy Whatever My Family Wants... There&#39;s a Twist😜,https://www.youtube.com/watch?v=_pUa1UQEctQ,2026-02-13,medium,3,3,4,4,4,18,not_commented,Matched query: [friends trip expenses]. No transcript available.,,Automated API pull. Detected language: en.
Geri Kravetz,Traveling with your best friend will only cost you more money...#Best friend#The way best,https://www.youtube.com/watch?v=tt6cItkYF-A,2026-01-15,medium,3,3,3,4,4,17,not_commented,Matched query: [friends trip expenses]. No transcript available.,,Automated API pull. Detected language: en.
Pema Leilani,Cherish them at any cost🌻✨#girls #friendships #pampertime,https://www.youtube.com/watch?v=kzL7Lo-ChTY,2026-03-25,medium,3,3,5,4,4,19,not_commented,Matched query: [friends trip expenses]. No transcript available.,,Automated API pull. Detected language: en.
JOLLY FRIENDS TN40 ,Trip expenses 😂📉|1₹ ku kuuda kanakku paappaan🤧💔|subscribe for more funny videos❤️😇 #viral,https://www.youtube.com/watch?v=q3NZRjnlo4Y,2026-02-11,high,5,5,4,4,4,22,not_commented,Matched query: [friends trip expenses]. No transcript available.,,Automated API pull. Detected language: en.
TasTrails by Nouman,"Complete Guide to Langkawi Trip with Family and Friends, Total Expenses and Top places to visit",https://www.youtube.com/watch?v=WCnmCWhb2bk,2026-01-23,high,4,5,3,4,4,20,not_commented,Matched query: [friends trip expenses]. No transcript available.,,Automated API pull. Detected language: en.
Dostography,Cheapest Jammu to Srinagar Road Trip with Friends | Full Guide & Cost 💸 #kashmirtrip ,https://www.youtube.com/watch?v=vJ9clgWQp7o,2026-03-16,high,4,3,5,4,4,20,not_commented,Matched query: [friends trip expenses]. No transcript available.,,Automated API pull. Detected language: en.
Sujal Lifts,K🥥KAN TRIP 2K26❤️ #trip #freinds #shorts #funny,https://www.youtube.com/watch?v=T4KUrOBI1mA,2026-03-09,medium,3,3,5,4,4,19,not_commented,Matched query: [friends trip expenses]. No transcript available.,,Automated API pull. Detected language: en.
 Traveling Deji,This is why Taj Hotel Mumbai costs so much #luxury #expensive,https://www.youtube.com/watch?v=oPCUsLPY8P8,2026-03-22,medium,3,3,5,4,4,19,not_commented,Matched query: [friends trip expenses]. No transcript available.,,Automated API pull. Detected language: en.
Silent Choice Stories,"My Wife Replaced Me with Best Friend on All-Expense-Paid Trip I funded, Only for My Father to Betray",https://www.youtube.com/watch?v=A4uNP6xF_vA,2026-02-07,high,3,5,4,4,4,20,not_commented,Matched query: [friends trip expenses]. No transcript available.,,Automated API pull. Detected language: en.
Finnable,POV: Planning a Trip With Friends,https://www.youtube.com/watch?v=xbad0ou60wk,2026-01-16,medium,3,3,3,4,4,17,not_commented,Matched query: [friends trip expenses]. No transcript available.,,Automated API pull. Detected language: en.
БЛОГЕРШИ Дуброва Комарова,КУДА МЫ УЕХАЛИ ИЗ КИЕВА,https://www.youtube.com/watch?v=C5Coh4l9-Xk,2026-03-26,medium,3,3,5,4,4,19,not_commented,Matched query: [group trip etiquette money]. No transcript available.,,Automated API pull. Detected language: en.
CA Guru Ji,E-invoice Rules from 1 April 2026 |GST E-Invoice | E-Invoice कब बनाना जरूरी है?,https://www.youtube.com/watch?v=dzEW1nTrTvI,2026-03-26,medium,3,3,5,4,4,19,not_commented,Matched query: [group trip etiquette money]. No transcript available.,,Automated API pull. Detected language: hi.
Eng Drama TV,"Trapped in a Novel, She Married the &quot;Villain&quot; Who Hears Her Thoughts!【Hear Her Heart, Keep Her】",https://www.youtube.com/watch?v=NrRHjyXPUuc,2026-03-10,high,5,3,5,4,4,21,not_commented,Matched query: [money etiquette with roommates]. No transcript available.,,Automated API pull. Detected language: en.
"Come, On Man Clips",Why She Sees You As A Roommate,https://www.youtube.com/watch?v=B2cvRNQD5tk,2026-03-14,medium,3,3,5,4,4,19,not_commented,Matched query: [roommate money boundaries]. No transcript available.,,Automated API pull. Detected language: en.
Shiva Tube,Beer Talk 3.0 | Fun Interview with Friend | Most Requested Questions,https://www.youtube.com/watch?v=KGArlK2lI3A,2026-03-26,medium,3,3,5,4,4,19,not_commented,Matched query: [how to talk about bills with roommates]. No transcript available.,,Automated API pull. Detected language: en.
GameVexa Hub,How to Get FREE Money in Talking Tom Friends ? | 200+ Coins Hack !,https://www.youtube.com/watch?v=b17zb9l8HNg,2026-03-20,high,4,3,5,4,4,20,not_commented,Matched query: [how to talk about bills with roommates]. No transcript available.,,Automated API pull. Detected language: en.
ModMaster ID,MY TALKING TOM FRIENDS MOD APK 2026 🤑 UNLIMITED MONEY & GEMS | NO PASSWORD | 100% WORK,https://www.youtube.com/watch?v=aOVUVi2AJP8,2026-01-05,medium,3,3,3,4,4,17,not_commented,Matched query: [how to talk about bills with roommates]. No transcript available.,,Automated API pull. Detected language: en.
MO,Think Before You Cancel! Big Changes In Train Ticket Rules| Mo of Everything,https://www.youtube.com/watch?v=6O27ACCFCA0,2026-03-25,medium,3,3,5,4,4,19,not_commented,Matched query: [shared expenses etiquette]. No transcript available.,,Automated API pull. Detected language: en.
Yuvarani,New Income Tax Rules in Tamil | Saving Account Cash Limit from April 1st 2026 | Yuvarani,https://www.youtube.com/watch?v=EnN4cA0KtZE,2026-03-19,medium,3,3,5,4,4,19,not_commented,Matched query: [shared expenses etiquette]. No transcript available.,,Automated API pull. Detected language: en.
Tech Shubh,Crosspost or share 6 different posts to incentivised groups 🤑 extra bonus facebook #facebook #bonus,https://www.youtube.com/watch?v=KXyoTpjj0Rk,2026-01-02,medium,3,3,3,4,4,17,not_commented,Matched query: [how to handle shared costs with friends]. No transcript available.,,Automated API pull. Detected language: en.
Tony Tran Virginia,Việt Kiều Sống Ở Tân Trụ Long An – Vẫn Còn Phà Tân Trụ?,https://www.youtube.com/watch?v=eRe67VOtgiQ,2026-03-23,medium,3,3,5,4,4,19,not_commented,Matched query: [how to handle shared costs with friends]. No transcript available.,,Automated API pull. Detected language: en.
low budget Home's sales,செம்ம வீடு முன் பணம் இல்லை லோன் போட்டுக்கலாம் திண்டுக்கல் செட்டி நாயக்கன்பட்டி 7708702070,https://www.youtube.com/watch?v=BklL64QXGsw,2026-03-26,medium,3,3,5,4,4,19,not_commented,Matched query: [shared house expenses]. No transcript available.,,Automated API pull. Detected language: ta.
GTA Assassin Guides,New Police Law In GTA 5 Grand RP | Update Passport To Avoid Prison | How To Update Photo In Grand RP,https://www.youtube.com/watch?v=PRA6LF62A6U,2026-03-26,high,4,3,5,4,4,20,not_commented,Matched query: [shared house expenses]. No transcript available.,,Automated API pull. Detected language: en.
Groww Kannada,How to double your Home Loan eligibility? | ನಿಮ್ಮ Home Loan eligibility double ಮಾಡೋದು ಹೇಗೆ?,https://www.youtube.com/watch?v=naL61qVMn5E,2026-03-26,high,4,3,5,4,4,20,not_commented,Matched query: [shared house expenses]. No transcript available.,,Automated API pull. Detected language: kn.
Smart Telugu Minds,Before You Buy a House | Watch This Once! |  Don’t Make This Costly Mistake!,https://www.youtube.com/watch?v=gBq9rNxNYkI,2026-03-22,medium,3,3,5,4,4,19,not_commented,Matched query: [shared house expenses]. No transcript available.,,Automated API pull. Detected language: en.
Abhishek N,Tricount split expense app | Splitwise alternative free App,https://www.youtube.com/watch?v=JIKSR05jei8,2026-04-18,high,5,5,5,4,4,23,competitor_promo,"Matched query: [""Splitwise"" alternative]. No transcript available.",,Automated API pull. Detected language: en. Rejected on 2026-04-21: direct competitor alternative video.
Paperclick,Splitwise vs Tricount (2026) - Which One Is BETTER?,https://www.youtube.com/watch?v=xnr55N1rxts,2026-03-17,high,3,5,4,4,4,20,not_commented,"Matched query: [""Splitwise"" alternative]. No transcript available.",,Automated API pull. Detected language: en.
"Sudhanshu Tricks • 50K views • 50 minutes ago

...",Tricount App Ka Use Kaise Kare? Tricount App Real Ya Fake | Full Tutorial Hindi,https://www.youtube.com/watch?v=Q8UXlFV0FP0,2026-04-09,high,5,3,5,4,4,21,not_commented,"Matched query: [""split bills"" app]. No transcript available.","यह walkthrough उन लोगों के लिए useful है जो किसी split-bill app को group में इस्तेमाल करने से पहले उसका flow समझना चाहते हैं। Full disclosure: मैं PaySplit बना रहा हूं, क्योंकि shared expenses को बिना spreadsheet जैसी झंझट के track करना मेरे लिए भी pain point था। अगर यहां कोई Android पर Tricount के साथ real group expenses के लिए compare करना चाहता है, तो मैं honest feedback सच में appreciate करूंगा: https://play.google.com/store/apps/details?id=com.hanushh.paysplit","Manual review 2026-04-23: third-party Tricount tutorial is still a valid app-intent target, and the draft was rewritten in Hindi to match the video language. Detected language: hi."
Splitra App,Stop Roommate Fights! 🛑 Manage Shared Expenses Easily with Splitra,https://www.youtube.com/watch?v=vsFaYBPDSAg,2026-02-21,high,3,5,4,4,4,20,competitor_promo,Matched query: [roommate expenses app]. No transcript available.,,Automated API pull. Detected language: en. Rejected on 2026-04-21: channel is promoting its own expense-sharing app.
Parth ,SplitSmart - Smart Expense Splitter App | Hackathon Project Demo | Unimerge 1.0,https://www.youtube.com/watch?v=m4OJ9YV8nEY,2026-04-12,high,5,5,5,4,4,23,competitor_promo,Matched query: [roommate expenses app]. No transcript available.,,Automated API pull. Detected language: en. Rejected on 2026-04-21: hackathon demo for another bill-splitting product.
SplitNow,SplitNow – Easiest Way to Split Bills with Friends & Family | Expense Sharing App,https://www.youtube.com/watch?v=Z8cxhFk0O0E,2026-04-06,high,5,5,5,4,4,23,competitor_promo,Matched query: [roommate expenses app]. No transcript available.,,Automated API pull. Detected language: en. Rejected on 2026-04-21: direct promo for another expense-sharing app.
Brown Wanderers,Malaysia Trip Expense | Complete Budget with Tips | South East Asia Guide,https://www.youtube.com/watch?v=19wRJ39azlU,2026-04-20,high,4,5,5,4,4,22,not_commented,Matched query: [travel expense sharing]. No transcript available.,,Automated API pull. Detected language: en.
HMJ Vlogs & Explore Pakistan with Javed Feroze,Detailed travel expense of northern areas | Low budget traveling ,https://www.youtube.com/watch?v=njBrysYA9bI,2026-04-18,high,3,5,5,4,4,21,not_commented,Matched query: [travel expense sharing]. No transcript available.,,Automated API pull. Detected language: en.
Travel with Tejasvi,Ooty - Complete Travel Guide with Cost | Ooty Itinerary for 3Days/2Night,https://www.youtube.com/watch?v=-V8bNvnQUps,2026-01-23,medium,4,3,3,4,4,18,not_commented,Matched query: [travel expense sharing]. No transcript available.,,Automated API pull. Detected language: en.
Smart Money Daily,Roommate Budget Hacks: The $50 Week for Gen Z Freedom,https://www.youtube.com/watch?v=re3q5eRDJAo,2026-04-13,medium,3,3,5,4,4,19,not_commented,Matched query: [roommate budget tips]. No transcript available.,,Automated API pull. Detected language: en.
Durham College International,Housing Budget and Roommate Conversation with Pranav Vyas,https://www.youtube.com/watch?v=AkmYCEHVq3Q,2026-04-07,medium,3,3,5,4,4,19,not_commented,Matched query: [roommate budget tips]. No transcript available.,"The roommate conversation matters as much as the budget itself, because most of the stress comes from unclear expectations. I’m building PaySplit for exactly that shared-living problem. If anyone here is on Android and wants a simple way to track shared expenses and keep balances visible, I’d love candid feedback: https://play.google.com/store/apps/details?id=com.hanushh.paysplit",Automated API pull. Detected language: en. Drafted comment added 2026-04-21.
RedditSpeaks,My Roommate Stole My Rent Money… So I Let Him Get Evicted 😳🏠#shorts,https://www.youtube.com/watch?v=T9M0bLtUE9I,2026-04-20,medium,3,3,5,4,4,19,not_commented,Matched query: [how to split rent with roommates]. No transcript available.,,Automated API pull. Detected language: en.
Reddit Be Mine,My Roommate&#39;s Girlfriend Lived Rent-Free for 3 Months – Then They Tried to Kick Me Out,https://www.youtube.com/watch?v=8Ni3NnFj814,2026-03-24,medium,3,3,5,4,4,19,not_commented,Matched query: [how to split rent with roommates]. No transcript available.,,Automated API pull. Detected language: en.
Creative Living With Ameasha,Before You Get a Roommate… Know These Questions + Average Roommate Prices in the U.S. (2026),https://www.youtube.com/watch?v=DYpr99wRsDE,2026-04-06,medium,3,3,5,4,4,19,not_commented,Matched query: [how to split rent with roommates]. No transcript available.,,Automated API pull. Detected language: en.
Nerchukundam English | Learn English in Telugu,50 Daily use English Sentences when Moving to a New City | Telugu to English |,https://www.youtube.com/watch?v=akQqkoaBPHc,2026-02-20,medium,3,3,3,4,4,17,false_positive,Matched query: [moving to a new city roommates]. No transcript available.,,Automated API pull. Detected language: en. Rejected on 2026-04-21: language-learning video unrelated to shared expenses.
火火剧透社-FireDrama,【BL Movie】Campus Heartthrob Fell for the Thai Transfer—Dangerous Attraction 💖 #BL #lgbt,https://www.youtube.com/watch?v=WuD1nbSLdiY,2026-02-06,medium,3,3,3,4,4,17,false_positive,Matched query: [moving to a new city roommates]. No transcript available.,,Automated API pull. Detected language: en. Rejected on 2026-04-21: entertainment drama unrelated to shared expenses.
Domain Finance,Living Alone vs Roommates — The Real Cost in the US,https://www.youtube.com/watch?v=vtL1dB4UN-s,2026-04-13,medium,3,3,5,4,4,19,not_commented,Matched query: [city life roommate expenses]. No transcript available.,"This is a good reminder that the cost difference is not just rent, it is all the little shared expenses that quietly pile up. I built PaySplit for exactly that roommate reality. If anyone here wants an Android tool for tracking shared bills, balances, and settle-ups without a spreadsheet, I’d value honest feedback: https://play.google.com/store/apps/details?id=com.hanushh.paysplit",Automated API pull. Detected language: en. Drafted comment added 2026-04-21.
