subreddit,post_title,post_url,post_date,priority,intent_score,fit_score,freshness_score,promo_safety_score,android_score,total_score,status,why_it_fits,suggested_reply,notes,reviewed,reviewed_at
r/roommates,Splitwise is driving me insane - anyone else?,https://www.reddit.com/r/roommates/comments/1lni3v1/splitwise_is_driving_me_insane_anyone_else/,2025-06-29,high,5,5,3,3,4,20,posted,Direct request for a roommate-friendly alternative after frustration with Splitwise and manual follow-up.,"Full disclosure: I'm building PaySplit because I ran into the same problem with roommate groups. The goal is to make shared expenses, balances, and settle-ups simple so one person doesn't have to play accountant, and it supports equal, exact, and percentage splits. If you're still looking, I'd genuinely love your feedback on whether it solves the reminder and middleman problem for your house: https://play.google.com/store/apps/details?id=com.hanushh.paysplit",Confirmed PaySplit reply is live on 2026-03-26. Check subreddit rules before posting follow-ups.,,
r/apps,I can't find Splitwise alternative that suits my needs,https://www.reddit.com/r/apps/comments/1nzie0q/i_cant_find_splitwise_alternative_that_suits_my/,2025-10-06,high,5,5,4,3,4,21,not_posted,OP wants a simple expense-splitting app for a roommate without heavy extra features.,"Full disclosure: I'm building PaySplit. I wanted the same basic flow you described: create a group, add expenses quickly, see balances, and settle up without a bunch of extra clutter. If that's close to what you want, I'd really appreciate brutally honest feedback on the current build: https://play.google.com/store/apps/details?id=com.hanushh.paysplit",Lead with empathy for the simple UX request; avoid overselling features you did not mention.,,
r/apps,Splitwise alternative with default split ratio,https://www.reddit.com/r/apps/comments/1i059e9/splitwise_alternative_with_default_split_ratio/,2025-01-13,medium,5,4,1,3,4,17,not_posted,Very strong intent signal from someone managing a repeated non-50/50 household split.,"Full disclosure: I'm building PaySplit. It already supports percentage-based splits, running balances, and settle-ups. I'm not sure we have your exact saved default-ratio workflow yet, but that's exactly the kind of repeated household use case I care about. If you're open to it, try the current version and I can use your feedback to prioritize that flow: https://play.google.com/store/apps/details?id=com.hanushh.paysplit",Be explicit that percentage splits exist but saved default ratios may still need work.,,
r/Adulting,how do you split bills,https://www.reddit.com/r/Adulting/comments/1k2dtbz/,2025-04-18,medium,2,4,2,4,4,16,not_posted,Broad question about bill-splitting method where a useful and low-pressure recommendation can fit naturally.,"What usually works best is agreeing on the rule first, like 50/50 or income-based, and then using one shared tracker so nobody has to remember who covered what. Full disclosure: I'm building PaySplit for exactly that kind of shared-expense setup. It helps groups track expenses, see balances, and settle up in one place: https://play.google.com/store/apps/details?id=com.hanushh.paysplit",Keep this one advice-first and product-second.,,
r/renting,how to split rent with roommates who are also our friends?,https://www.reddit.com/r/renting/comments/1r3l3vl/how_to_split_rent_with_roommates_who_are_also_our/,2026-02-13,high,3,5,5,3,4,20,not_posted,Fresh thread about a nuanced roommate split where exact and percentage-based tracking is relevant.,"For a setup like this, I'd separate rent from utilities: agree on the rent formula once, then track utilities and shared extras in one place so it doesn't turn into a monthly argument. Full disclosure: I'm building PaySplit, and it supports equal, exact, and percentage splits plus running balances and settle-ups, which helps once the formula is agreed on: https://play.google.com/store/apps/details?id=com.hanushh.paysplit",Strong current-fit thread; still keep the comment helpful instead of salesy.,,
r/badroommates,Splitting bills with my roommate,https://www.reddit.com/r/badroommates/comments/1raas3j/splitting_bills_with_my_roommate/,2026-02-20,medium,2,4,5,3,4,18,not_posted,Recurring utilities disagreement is a good fit for a visibility and ledger-focused recommendation.,"If you already agreed to split recurring house costs, the cleanest thing is to track them as fixed shared bills so there is less room for later arguments about what counts. Full disclosure: I'm building PaySplit for situations like this. It keeps the ledger visible so both people can see what was split and what's still outstanding: https://play.google.com/store/apps/details?id=com.hanushh.paysplit",Best used if the thread is still active and not already saturated with self-promo.,,
r/roommates,How do you and your friends usually split the bill when going out?,https://www.reddit.com/r/roommates/comments/1oyauab/how_do_you_and_your_friends_usually_split_the/,2025-11-16,medium,3,4,4,4,4,19,not_posted,Pain-point discussion about delayed payback where a light product mention can work if framed as feedback-seeking.,"Usually the least awkward setup is one person pays, everyone logs it right away, and the group can see balances in one place. Full disclosure: I'm building PaySplit because Venmo plus memory breaks down fast in groups. If you'd be up for trying a lightweight shared-expense tracker, I'd love to know what feels missing: https://play.google.com/store/apps/details?id=com.hanushh.paysplit",Treat this as a softer outreach thread rather than a hard conversion opportunity.,,
r/roommates,How are you guys splitting rent and utilities with roommates?,https://www.reddit.com/r/roommates/comments/1rik32p/how_are_you_guys_splitting_rent_and_utilities/,2026-03-02,high,4,5,5,2,4,20,not_posted,Fresh roommate thread explicitly asking what tools people use and what pain points they have with rent and utility tracking.,"The biggest thing that helps is having one visible running balance and logging shared buys right away, otherwise the little expenses are what create the tension. Full disclosure: I'm building PaySplit for exactly that roommate use case. It supports shared expenses, balances, and settle-ups in one place, and I'd love to know if the Android app feels simpler than the tools you've tried: https://play.google.com/store/apps/details?id=com.hanushh.paysplit",There are already product mentions in the thread and one anti-app comment, so keep the tone especially helpful and low-pressure.,
r/Apartmentliving,pls help splitting rent fairly!,https://www.reddit.com/r/Apartmentliving/comments/1pddyzc/pls_help_splitting_rent_fairly/,2025-12-03,medium,2,4,3,4,4,17,not_posted,Specific fair-rent dispute where an advice-first reply can naturally introduce exact or percentage tracking once the group agrees on the rule.,"The cleanest way is to separate room value from shared-person costs: set a room-based rent split first, then split utilities across all 5 people so the extra occupancy is accounted for. Full disclosure: I'm building PaySplit, and it helps groups track exact, equal, or percentage splits plus a running balance once you land on the rule: https://play.google.com/store/apps/details?id=com.hanushh.paysplit",Good fit for a practical advice-first comment rather than a direct app pitch.,,
r/Renters,How to fairly split rent? (Chicago, IL),https://www.reddit.com/r/Renters/comments/1rr7trt/how_to_fairly_split_rent_chicago_il/,2026-03-11,medium,2,4,5,4,4,19,not_posted,Fresh rent-splitting question with clear demand for transparent math around unequal room and bathroom value.,"I’d price the bigger room plus private bath at a premium instead of forcing a flat 60/40 by gut feel, then write the rule down before you start screening someone. Full disclosure: I'm building PaySplit, and it’s useful once you want to track exact or percentage splits and keep the running balance visible without a spreadsheet: https://play.google.com/store/apps/details?id=com.hanushh.paysplit",Freshest advice-led opportunity from this run; still edit to match thread tone before posting.,
r/Apartmentliving,roommates are couple but we do 50/50 for rent/utils,https://www.reddit.com/r/Apartmentliving/comments/1rxcef2/roommates_are_couple_but_we_do_5050_for_rentutils/,2026-03-18,high,3,5,5,4,4,21,not_posted,Fresh high-engagement roommate thread about unfair 50/50 rent and utility math with explicit discussion of Splitwise-style tracking for utilities and a strong PaySplit fit around exact splits and visible balances.,"Utilities should really be split by person here even if you keep the room-based rent logic, otherwise you are subsidizing two people’s usage every month. Full disclosure: I am building PaySplit for exactly this kind of shared-expense setup, and it handles equal, exact, and percentage splits with running balances so the math stays visible instead of becoming a recurring argument: https://play.google.com/store/apps/details?id=com.hanushh.paysplit",Fresh thread with strong engagement as of 2026-03-31; advice-first reply is safer than a hard pitch.,,
r/Advice,Shared expenses are driving me nuts. Am I ignoring any blatantly easy ideas or better ways to split bills?,https://www.reddit.com/r/Advice/comments/1qx46mj/shared_expenses_are_driving_me_nuts_am_i_ignoring/,2026-02-06,medium,4,5,4,3,4,20,not_posted,"Detailed shared-expense pain point from a couple juggling rent, utilities, pet costs, and separate accounts; the OP explicitly asks for a lower-friction system and commenters are already recommending tracking apps.","If you want to keep finances separate, the cleanest setup is usually one shared ledger for bills plus one settle-up instead of re-balancing each category manually every month. Full disclosure: I am building PaySplit for exactly that kind of shared-expense setup, with running balances and flexible splits so you can keep separate accounts without doing spreadsheet math: https://play.google.com/store/apps/details?id=com.hanushh.paysplit",Still useful but slightly softer fit because the update suggests they may stick with cash transfer tools; keep the tone practical and low-pressure.,,
